id,created_utc,subreddit,author,body,score,parent_id,link_id,permalink,controversiality,is_submitter
koxaggb,1707077518.0,ValorantCompetitive,Ochinchin6969111,"It's mostly due to stereotypes and lack of support for females in general.
Videogames have been considered masculine since the begining and has only been more accepted for males with the stereotype that games are for nerds being gone.
On the other hand girls are usually discouraged or straight up banned from playing videogames since young and even till today there's still some stigma regarding girls and video games.

Of course today, more girls play videogames but it doesn't change the fact that most still prefer to do more ""feminine"" stuff and those who do play games often don't have the freedom or interest to dedicate themselves to those games.

As a result you get a far larger pool of male players who actively grind competitive games to reach the top than females, and of course if you're an organisation looking to win, you would pick a male who is statistically more likely to be good at the game.

It's also not like there aren't any girls who are cracked, within GC in many teams there are at least 1 or 2 who have insane aim who can totally compete or surpass most males in ascension or even franchised teams. At the same time it's not like every male player out there has god aim and it's still quite a rarity for a player to aim as good as demon1, nats, tenz etc.

eSports alone is already a pretty unstable career and economy and being a girl makes it even harder to have career as a player. To even consider an eSports career is an uphill battle, to be a female player is an uphill battle with natural disasters in your way. With so little stability and incentive, its not really a surprise that not many girls are willing to grind like crazy.

In the future when eSports becomes more viable for girls, it wouldn't be surprising for full female teams to be in contention for being a top team, but right now the odds may as well be zero.",1,t1_koupjno,t3_1ahzu82,/r/ValorantCompetitive/comments/1ahzu82/congrats_bob/koxaggb/,0,False
kox8uys,1707076951.0,ValorantCompetitive,sebaba001,"Sounds like he's reading, and very slowly. Need to read faster and keep a conversational tone.",1,t3_1aitbcb,t3_1aitbcb,/r/ValorantCompetitive/comments/1aitbcb/this_team_is_ready_for_the_no_skye_meta_sliggy/kox8uys/,0,False
kox5ynz,1707075930.0,ValorantCompetitive,XxMyUsernameSucksxX,No yeah I definitely agree that the structure and editing were good especially for my pea sized brain. It's just that the voiceover wasn't the best lol,1,t1_kox510h,t3_1aitbcb,/r/ValorantCompetitive/comments/1aitbcb/this_team_is_ready_for_the_no_skye_meta_sliggy/kox5ynz/,0,False
kox510h,1707075600.0,ValorantCompetitive,mysteryoeuf,"counterpoint: the editing and structure and voiceover of this video were extremely clear and concise. even though it felt like a time capsule/outdated, I was really engaged and enjoyed the whole thing.


I'm sure the effort that went into this was 50x a normal unscripted reaction-to-patch-notes video but I definitely enjoyed it",1,t1_kox0eti,t3_1aitbcb,/r/ValorantCompetitive/comments/1aitbcb/this_team_is_ready_for_the_no_skye_meta_sliggy/kox510h/,0,False
kox2vvq,1707074838.0,ValorantCompetitive,ValorantWorld_,Of course I will!,1,t1_kor64ic,t3_1ah9b4y,/r/ValorantCompetitive/comments/1ah9b4y/vct_2024_simulations_results/kox2vvq/,0,False
kox2ks3,1707074728.0,ValorantCompetitive,SirAwesome789,Sengoku Gaming,1,t1_kowgqae,t3_1aiqd6m,/r/ValorantCompetitive/comments/1aiqd6m/varrels_bind_comp_in_japan_challengers/kox2ks3/,0,False
kox1opa,1707074410.0,ValorantCompetitive,Zorronin,"i did not know until now that i needed a 2 hour jon bois VCT video, but boy did i",1,t3_1aivu59,t3_1aivu59,/r/ValorantCompetitive/comments/1aivu59/if_yall_like_jon_bois_videos_i_made_one_about_the/kox1opa/,0,False
kox0r1s,1707074073.0,ValorantCompetitive,SPOOKESVILLE,"There is Overwatch champion series which is still ran by blizzard. It’s *also* ran by FACEIT. They definitely could’ve kept Uber around for something if they could’ve afforded him, but I’m glad he jumped ship.",1,t1_kouwubi,t3_1ai4t6g,/r/ValorantCompetitive/comments/1ai4t6g/english_talent_for_vct_americas/kox0r1s/,0,False
kox0eti,1707073950.0,ValorantCompetitive,XxMyUsernameSucksxX,"Nah, (from what I know) he just sucks with voiceover lol",1,t1_kox07en,t3_1aitbcb,/r/ValorantCompetitive/comments/1aitbcb/this_team_is_ready_for_the_no_skye_meta_sliggy/kox0eti/,0,False
kox07en,1707073875.0,ValorantCompetitive,fairlylocal2,was it actually AI? Something felt off compared to his liquid videos but I couldn’t tell what it was,1,t1_kowl4f4,t3_1aitbcb,/r/ValorantCompetitive/comments/1aitbcb/this_team_is_ready_for_the_no_skye_meta_sliggy/kox07en/,0,False
kox06pn,1707073869.0,ValorantCompetitive,fortheloveofmoney78,I'd get hyped for the dunkin glazers.,1,t1_kowqqxr,t3_1ait7os,/r/ValorantCompetitive/comments/1ait7os/challengers_na_open_quals_1_congrats_to_sad/kox06pn/,0,False
kowz94j,1707073533.0,ValorantCompetitive,quasur,fakers 27 and still the undisputed goat of league,1,t3_1ah0iu0,t3_1ah0iu0,/r/ValorantCompetitive/comments/1ah0iu0/whats_the_usual_lifespan_of_a_pros_career/kowz94j/,0,False
kowxraj,1707073005.0,ValorantCompetitive,NebularCarina,https://i.redd.it/axvwx5tg8mgc1.gif,42,t3_1aip1wt,t3_1aip1wt,/r/ValorantCompetitive/comments/1aip1wt/team_orangutan_retakes_the_wrong_site_vs_revenant/kowxraj/,0,False
kowxpk2,1707072989.0,ValorantCompetitive,sebaba001,That's some serious yapping. Why would you not run a flasher when every flashing agent has other useful stuff in their arsenal and there's like 10 of them.,1,t1_kowc9ne,t3_1aiqd6m,/r/ValorantCompetitive/comments/1aiqd6m/varrels_bind_comp_in_japan_challengers/kowxpk2/,0,False
kowxk4k,1707072936.0,ValorantCompetitive,Tyler123839,Oof yeah that confirms it. Tara is not a bad player but it definitely feels like there was some internal conflict because there is no way she matches kohaibi.,1,t1_kovrexf,t3_1aijcny,/r/ValorantCompetitive/comments/1aijcny/team_smg_release_their_game_changers_roster/kowxk4k/,0,False
kowxep8,1707072884.0,ValorantCompetitive,sebaba001,Let them cook,1,t3_1aiqd6m,t3_1aiqd6m,/r/ValorantCompetitive/comments/1aiqd6m/varrels_bind_comp_in_japan_challengers/kowxep8/,0,False
kowtmr0,1707071569.0,ValorantCompetitive,ExtremelySilly514,Bros just yapping,1,t1_kousq3u,t3_1ahzu82,/r/ValorantCompetitive/comments/1ahzu82/congrats_bob/kowtmr0/,0,False
kows6ij,1707071074.0,ValorantCompetitive,KungFuEli,That’s my boy infiltrator,1,t3_1aifn7k,t3_1aifn7k,/r/ValorantCompetitive/comments/1aifn7k/winthrop_university_vs_thinking_men_challengers/kows6ij/,0,False
kowrqs6,1707070929.0,ValorantCompetitive,_124578_,"Aim gods, except for juicy with the raze ult. I’m pretty sure he only got like 1 kill with it over 6 maps of raze",1,t1_kown13u,t3_1aildxu,/r/ValorantCompetitive/comments/1aildxu/dsgs_results_for_sgmy_challengers_qualifiers/kowrqs6/,0,False
kowqqxr,1707070590.0,ValorantCompetitive,Intrepid-Tank-3414,It would be perfect if they get sponsored by Dunkin Donut or Krispy Kream!,1,t1_kowp7ku,t3_1ait7os,/r/ValorantCompetitive/comments/1ait7os/challengers_na_open_quals_1_congrats_to_sad/kowqqxr/,0,True
kowqc13,1707070445.0,ValorantCompetitive,BakedFish---SK,"Idk I stopped watching him, I just saw the video in my recommended",1,t1_kowp2gg,t3_1aiqd6m,/r/ValorantCompetitive/comments/1aiqd6m/varrels_bind_comp_in_japan_challengers/kowqc13/,0,False
kowp7ku,1707070048.0,ValorantCompetitive,Familiar-Leading,I love the fact there's just a glazed donut in between all these logos it's just so perfect ,1,t3_1ait7os,t3_1ait7os,/r/ValorantCompetitive/comments/1ait7os/challengers_na_open_quals_1_congrats_to_sad/kowp7ku/,0,False
kowp2gg,1707069998.0,ValorantCompetitive,DannyLansdon,"Was he seriously suggesting a no flash meta? What basis was he using? I usually don’t watch him just cuz I tend to not agree with his takes as much as other analysts, i don’t want to discount him but that sounds like a very not serious take",1,t1_kowc9ne,t3_1aiqd6m,/r/ValorantCompetitive/comments/1aiqd6m/varrels_bind_comp_in_japan_challengers/kowp2gg/,0,False
kownd59,1707069411.0,ValorantCompetitive,Bhu124,"The qualifiers weren't being broadcast by the TO because the region is small. DSG got permission for their coach to stream the games to Toast, who could then stream them on his Twitch. 

Other teams weren't streaming their games/PoVs.",1,t1_kowkll1,t3_1aildxu,/r/ValorantCompetitive/comments/1aildxu/dsgs_results_for_sgmy_challengers_qualifiers/kownd59/,0,True
kown13u,1707069295.0,ValorantCompetitive,Splaram,"These guys are aim gods, very excited to watch this season",1,t3_1aildxu,t3_1aildxu,/r/ValorantCompetitive/comments/1aildxu/dsgs_results_for_sgmy_challengers_qualifiers/kown13u/,0,False
kowlvz3,1707068899.0,ValorantCompetitive,ideal_ive,I've hard it's Cest,1,t1_kot5oi5,t3_1ahx7vq,/r/ValorantCompetitive/comments/1ahx7vq/emerge_drx_meet_the_teams_24/kowlvz3/,0,False
kowlovs,1707068830.0,ValorantCompetitive,ideal_ive,"Waiting for them to dominate for years with a foreign head coach, sack him after one bad internationals, win one last Masters, then never win anything ever again and start swapping Head Coaches every year.",1,t1_kotz9vl,t3_1ahx7vq,/r/ValorantCompetitive/comments/1ahx7vq/emerge_drx_meet_the_teams_24/kowlovs/,0,False
kowl4l9,1707068632.0,ValorantCompetitive,ideal_ive,"Exactly. While NA league players were being paid with mousepads, Japanese were being paid 50 bucks",1,t1_kor3ar3,t3_1ahpmes,/r/ValorantCompetitive/comments/1ahpmes/why_is_the_japanese_skill_scene_so_bad_despite/kowl4l9/,0,False
kowl4f4,1707068631.0,ValorantCompetitive,XxMyUsernameSucksxX,The editing is not that bad but I'd enjoy the video more if Sliggy was actually reading the script. Instead he used an A.I. smh.,1,t3_1aitbcb,t3_1aitbcb,/r/ValorantCompetitive/comments/1aitbcb/this_team_is_ready_for_the_no_skye_meta_sliggy/kowl4f4/,0,False
kowkpfo,1707068482.0,ValorantCompetitive,[deleted],[deleted],1,t3_1aitbcb,t3_1aitbcb,/r/ValorantCompetitive/comments/1aitbcb/this_team_is_ready_for_the_no_skye_meta_sliggy/kowkpfo/,0,False
kowknp0,1707068464.0,ValorantCompetitive,KaNesDeath,Majority of people who post here are new to esports.,1,t1_kowchvc,t3_1ai09lt,/r/ValorantCompetitive/comments/1ai09lt/so_we_arent_gonna_have_anyone_operating_the_emea/kowknp0/,0,False
kowkll1,1707068444.0,ValorantCompetitive,Sea-Temporary7380,Wouldn't the vods of the others be public too? I don't get how toast was allowed to stream it otherwise,1,t1_kov7nbb,t3_1aildxu,/r/ValorantCompetitive/comments/1aildxu/dsgs_results_for_sgmy_challengers_qualifiers/kowkll1/,0,False
kowkcx6,1707068359.0,ValorantCompetitive,Zahin1018,5 flashes geez (gekko included),1,t1_kow9dah,t3_1aiqd6m,/r/ValorantCompetitive/comments/1aiqd6m/varrels_bind_comp_in_japan_challengers/kowkcx6/,0,False
kowk5y4,1707068291.0,ValorantCompetitive,Intrepid-Tank-3414,"Imagine a viable college-to-pro route in Valorant, like how it works for decades in basketball and football.",1,t3_1aifn7k,t3_1aifn7k,/r/ValorantCompetitive/comments/1aifn7k/winthrop_university_vs_thinking_men_challengers/kowk5y4/,0,False
kowjt41,1707068165.0,ValorantCompetitive,ourladyj,Qualifiers are so hype,1,t3_1ait7os,t3_1ait7os,/r/ValorantCompetitive/comments/1ait7os/challengers_na_open_quals_1_congrats_to_sad/kowjt41/,0,False
kowjq8n,1707068138.0,ValorantCompetitive,thebestyoucan,Sometimes having a Jett player ruins your teams ability to play the spiciest comps.,1,t3_1aiqd6m,t3_1aiqd6m,/r/ValorantCompetitive/comments/1aiqd6m/varrels_bind_comp_in_japan_challengers/kowjq8n/,0,False
kowhew7,1707067332.0,ValorantCompetitive,Hopeful-Professor-40,"Zellsis plays Gekko on bind in ranked, SEN gonna copy this. John plays Astra and the rest remains the same from their old comp",1,t3_1aiqd6m,t3_1aiqd6m,/r/ValorantCompetitive/comments/1aiqd6m/varrels_bind_comp_in_japan_challengers/kowhew7/,0,False
kowh74a,1707067261.0,ValorantCompetitive,Key-Banana-8242,Woah,1,t1_kotxz7y,t3_1ai1q2g,/r/ValorantCompetitive/comments/1ai1q2g/fennel_syouta_ace_vs_scarz/kowh74a/,0,False
kowh2u1,1707067222.0,ValorantCompetitive,Key-Banana-8242,What’s this about,1,t1_kos00pi,t3_1ai47vq,/r/ValorantCompetitive/comments/1ai47vq/will_the_glazers_get_to_keep_their_name/kowh2u1/,0,False
kowgv8q,1707067154.0,ValorantCompetitive,turtsy__,"Sonofcar dropping 40 on map 1 and losing 
Despairge",1,t3_1aiddy8,t3_1aiddy8,/r/ValorantCompetitive/comments/1aiddy8/the_glazers_vs_1337_na_challengers_league_2024/kowgv8q/,0,False
kowgurf,1707067149.0,ValorantCompetitive,Key-Banana-8242,Yea replace jett with phoenix and Astra with omen,1,t1_kowfb1x,t3_1aiqd6m,/r/ValorantCompetitive/comments/1aiqd6m/varrels_bind_comp_in_japan_challengers/kowgurf/,0,False
kowgqae,1707067109.0,ValorantCompetitive,Key-Banana-8242,Against whom,1,t1_kowdurw,t3_1aiqd6m,/r/ValorantCompetitive/comments/1aiqd6m/varrels_bind_comp_in_japan_challengers/kowgqae/,0,False
kowgcq9,1707066975.0,ValorantCompetitive,Key-Banana-8242,I thought Korea had a dispute with Japan territorially not China,1,t1_kovziwn,t3_1agdqvb,/r/ValorantCompetitive/comments/1agdqvb/t1_confirms_team_skins_will_be_releasing_on_feb/kowgcq9/,0,False
kowfu0i,1707066791.0,ValorantCompetitive,Ochinchin6969111,Tbf teams could definitely make it work but probably not worth the effort unless you're paper rex,1,t1_kouw4f9,t3_1aiddy8,/r/ValorantCompetitive/comments/1aiddy8/the_glazers_vs_1337_na_challengers_league_2024/kowfu0i/,0,False
kowfb1x,1707066602.0,ValorantCompetitive,turtsy__,Needs more blinds tbh,1,t3_1aiqd6m,t3_1aiqd6m,/r/ValorantCompetitive/comments/1aiqd6m/varrels_bind_comp_in_japan_challengers/kowfb1x/,0,False
kowf4gu,1707066536.0,ValorantCompetitive,pewpewpunk,to answer your question: no lol,1,t1_kove59r,t3_1ahzu82,/r/ValorantCompetitive/comments/1ahzu82/congrats_bob/kowf4gu/,0,False
kowf3t9,1707066529.0,ValorantCompetitive,Ochinchin6969111,"I need to see universities become a major part of the valorant eSports ecosystem, this is sick",1,t3_1aifn7k,t3_1aifn7k,/r/ValorantCompetitive/comments/1aifn7k/winthrop_university_vs_thinking_men_challengers/kowf3t9/,0,False
kowemdl,1707066358.0,ValorantCompetitive,Intrepid-Tank-3414,"LMAO, looks like someone completely forgotten about DSG' dominating Open Quals run last season before running into the big dawgs.",1,t1_kov69jj,t3_1aildxu,/r/ValorantCompetitive/comments/1aildxu/dsgs_results_for_sgmy_challengers_qualifiers/kowemdl/,0,False
kq0al5p,1707695433.0,ValorantCompetitive,ojay1998,"&gt;We felt blindsided by the Skye change

*ba dum tss*",1,t3_1aofxht,t3_1aofxht,/r/ValorantCompetitive/comments/1aofxht/romero_zikz_talks_returning_to_100_thieves_as_the/kq0al5p/,0,False
kq0a704,1707695266.0,ValorantCompetitive,speeperr,"Cool to know, thanks.",1,t1_kpzw01r,t3_1aofxht,/r/ValorantCompetitive/comments/1aofxht/romero_zikz_talks_returning_to_100_thieves_as_the/kq0a704/,0,False
kq097f7,1707694851.0,ValorantCompetitive,lazys_world,I love seeing off meta comps. With good communication and planning surely anything can work,1,t3_1ao1yns,t3_1ao1yns,/r/ValorantCompetitive/comments/1ao1yns/reject_v_scarz_post_match_thread_reject_won_with/kq097f7/,0,False
kq090ta,1707694777.0,ValorantCompetitive,StarSerpent,"There are at least a few T2 orgs in North Africa, there’s a whole lotta nothing in sub Saharan Africa",1,t1_kq01o87,t3_1aojbab,/r/ValorantCompetitive/comments/1aojbab/we_should_never_forget_how_cool_it_is_that_the_4/kq090ta/,0,False
kq06twm,1707693850.0,ValorantCompetitive,sexyhooterscar24,nah this guy whiffed so many free Op shots. Players would just walk past him and he'd miss. Any other Oper and NRG gets either the same result or better.,1,t1_kpgs3ua,t3_1al7dp1,/r/ValorantCompetitive/comments/1al7dp1/plat_chats_vct_2024_tier_list/kq06twm/,0,False
kq06e80,1707693671.0,ValorantCompetitive,sexyhooterscar24,according to your own logic anyone in franchise is automatically better than all tier 2 players. so I guess DFM&gt; Every challengers team.,1,t1_kpgh9mr,t3_1al7dp1,/r/ValorantCompetitive/comments/1al7dp1/plat_chats_vct_2024_tier_list/kq06e80/,0,False
kq065ww,1707693577.0,ValorantCompetitive,Coach_McGuirk__,then why the fuck can i only play same map in the pro map pool in swiftplay now?,1,t1_kpnr981,t3_1amrj8u,/r/ValorantCompetitive/comments/1amrj8u/esportsgg_i_dont_know_who_asked_for_that_nrg_chet/kq065ww/,0,False
kq05f56,1707693276.0,ValorantCompetitive,Moist_Blackberry_,"no,",1,t3_1ao5duf,t3_1ao5duf,/r/ValorantCompetitive/comments/1ao5duf/sick_double_peek_from_jp_tier2_scene/kq05f56/,0,False
kq052u9,1707693132.0,ValorantCompetitive,TheCatsActually,"I know the rest of the world is pretty low on 100T given how poorly their 2023 went and how much of that roster remained, but I truly have some faith in 100T this year, in large part due to Zikz. 

Similar to how revitalized Sentinels looks this year despite disappointing last year, I believe most teams that look to be less than the sum of their parts just need a missing piece to suddenly realize their potential, and I think Zikz or Boostio could be those pieces.",1,t1_kpzkyns,t3_1aofxht,/r/ValorantCompetitive/comments/1aofxht/romero_zikz_talks_returning_to_100_thieves_as_the/kq052u9/,0,False
kq04xcb,1707693067.0,ValorantCompetitive,EagleswonSuperBowl52,NRG will take EG's spot and we will have the same thing.,1,t3_1aojbab,t3_1aojbab,/r/ValorantCompetitive/comments/1aojbab/we_should_never_forget_how_cool_it_is_that_the_4/kq04xcb/,0,False
kq04hde,1707692882.0,ValorantCompetitive,TheCatsActually,Imagine being sikezz with his NA genetics take and he's the only player on his team who isn't Asutralian LMAO,1,t1_kq02pon,t3_1aojbab,/r/ValorantCompetitive/comments/1aojbab/we_should_never_forget_how_cool_it_is_that_the_4/kq04hde/,0,False
kq037ot,1707692367.0,ValorantCompetitive,HouseCharacter4660,Makes 0 sense,1,t1_kpth7if,t3_1annjee,/r/ValorantCompetitive/comments/1annjee/i_asked_the_mod_team_and_some_beloved_redditors/kq037ot/,0,False
kq035ss,1707692346.0,ValorantCompetitive,HouseCharacter4660,"Bleed T1 DRX PRX will all be better then them, they are def not ""robbed""",1,t1_kptpx5z,t3_1annjee,/r/ValorantCompetitive/comments/1annjee/i_asked_the_mod_team_and_some_beloved_redditors/kq035ss/,0,False
kq02pon,1707692164.0,ValorantCompetitive,GoldClassGaming,Moist and Dark Zero do be COOKING,1,t1_kpzv3xj,t3_1aojbab,/r/ValorantCompetitive/comments/1aojbab/we_should_never_forget_how_cool_it_is_that_the_4/kq02pon/,0,False
kq02fl1,1707692052.0,ValorantCompetitive,holyfuckyouaredumb,![img](emote|t5_2g5ach|9339),1,t3_1aojbab,t3_1aojbab,/r/ValorantCompetitive/comments/1aojbab/we_should_never_forget_how_cool_it_is_that_the_4/kq02fl1/,0,False
kq01x94,1707691853.0,ValorantCompetitive,Nichol-Gimmedat-ass,Lmao true theyre the GOATs but its pretty telling that they had to self fund or fund raise their trip to Ascension. I cant see it being anything but freelance teams unless someone makes a crazy run and actually makes it into tier one,1,t1_kq01dl5,t3_1aojbab,/r/ValorantCompetitive/comments/1aojbab/we_should_never_forget_how_cool_it_is_that_the_4/kq01x94/,0,False
kq01ws0,1707691848.0,ValorantCompetitive,Splaram,But that's what makes things fun,1,t1_kpzq1rp,t3_1aofxht,/r/ValorantCompetitive/comments/1aofxht/romero_zikz_talks_returning_to_100_thieves_as_the/kq01ws0/,0,False
kq01o87,1707691758.0,ValorantCompetitive,Possibly_Parker,"north africa doesn't have any teams in franchising tho, so they are equally fucked",1,t1_kpzyldk,t3_1aojbab,/r/ValorantCompetitive/comments/1aojbab/we_should_never_forget_how_cool_it_is_that_the_4/kq01o87/,0,False
kq01dl5,1707691643.0,ValorantCompetitive,Original-Mongoose948,put some respect on **BONKERS**,1,t1_kpzzzwc,t3_1aojbab,/r/ValorantCompetitive/comments/1aojbab/we_should_never_forget_how_cool_it_is_that_the_4/kq01dl5/,0,False
kpzzzwc,1707691102.0,ValorantCompetitive,Nichol-Gimmedat-ass,"I think CS is probably the most popular here? Maybe not anymore, I dont watch Apex so Im not sure on that but maybe the others are right. Since Riot nuked the OPL our LoL league is a shitshow and Valorant basically doesnt exist.",1,t1_kpzswaf,t3_1aojbab,/r/ValorantCompetitive/comments/1aojbab/we_should_never_forget_how_cool_it_is_that_the_4/kpzzzwc/,0,False
kpzyldk,1707690561.0,ValorantCompetitive,GodOfPog,"Most people in esports when referring to Africa are referring to Sub-Saharan Africa, North Africa is generally included within the Middle East region (MENA = Middle East, North Africa) due to connectivity",1,t1_kpzw7mz,t3_1aojbab,/r/ValorantCompetitive/comments/1aojbab/we_should_never_forget_how_cool_it_is_that_the_4/kpzyldk/,0,False
kpzxoew,1707690214.0,ValorantCompetitive,Worsehackereverlolz,What does this mean? Ive been watching the current IEM Katowice tourney and the map looks just like a Val minimap. Doesn't seem like production or the casters interact with it on a level beyond zooming in or highlighting something,1,t1_kpy226y,t3_1ao78cn,/r/ValorantCompetitive/comments/1ao78cn/vct_overlay_wishlist/kpzxoew/,0,False
kpzxgdw,1707690131.0,ValorantCompetitive,Worsehackereverlolz,"Yeah, you would have to add a slightly different looking pie for every agent, dots can just be added or subtracted no prob",1,t1_kpyvm57,t3_1ao78cn,/r/ValorantCompetitive/comments/1ao78cn/vct_overlay_wishlist/kpzxgdw/,0,False
kpzw896,1707689670.0,ValorantCompetitive,[deleted],[deleted],1,t3_1ao1yns,t3_1ao1yns,/r/ValorantCompetitive/comments/1ao1yns/reject_v_scarz_post_match_thread_reject_won_with/kpzw896/,0,False
kpzw7mz,1707689663.0,ValorantCompetitive,Teradonn,Sentinels would be nothing without johnqt so they’re basically African,1,t1_kpzrhwe,t3_1aojbab,/r/ValorantCompetitive/comments/1aojbab/we_should_never_forget_how_cool_it_is_that_the_4/kpzw7mz/,0,False
kpzw01r,1707689585.0,ValorantCompetitive,mochihammer,"Yeah, he was an analyst on pre-franchise NRG with that Ethan, Tex, hazed, s0m, eeiu lineup. Although the half shield thing was cooked up by DeMars DeRover their analyst, who’s with Team Liquid CS now",1,t1_kpzkyns,t3_1aofxht,/r/ValorantCompetitive/comments/1aofxht/romero_zikz_talks_returning_to_100_thieves_as_the/kpzw01r/,0,False
kpzv3xj,1707689272.0,ValorantCompetitive,ANewHeaven1,Apex Legends is probably the best contender but there’s a couple of solid Australian imports playing in LCS for what it’s worth,1,t1_kpzswaf,t3_1aojbab,/r/ValorantCompetitive/comments/1aojbab/we_should_never_forget_how_cool_it_is_that_the_4/kpzv3xj/,0,False
kpzui9o,1707689059.0,ValorantCompetitive,mightyburrito420,"Moist has been consistent as well, they have an australian team that now plays in NA.",1,t1_kpzt86t,t3_1aojbab,/r/ValorantCompetitive/comments/1aojbab/we_should_never_forget_how_cool_it_is_that_the_4/kpzui9o/,0,False
kpztve2,1707688841.0,ValorantCompetitive,Descendant3999,Do it like pubg/Apex. Have a second stream with just the map on the screen,1,t1_kpxo5jr,t3_1ao78cn,/r/ValorantCompetitive/comments/1ao78cn/vct_overlay_wishlist/kpztve2/,0,False
kpzq1rp,1707687541.0,ValorantCompetitive,TrynaSleep,I’m afraid to have hope 🫠,1,t1_kpzkyns,t3_1aofxht,/r/ValorantCompetitive/comments/1aofxht/romero_zikz_talks_returning_to_100_thieves_as_the/kpzq1rp/,0,False
kpzlbn4,1707685957.0,ValorantCompetitive,my-dad-ate-my-toes,"I can’t relate. Every evening I go to bed with a smile on my face. My pillow is as soft as air. My room temperature is perfect. I’m hydrated. Safe. In my lane. Content. The world just feels so good right now. Then when I finally drift off into sleep, I can see it. keznit is on for an ace. There’s screams from the crowd. Not many people but still so loud it fills the whole arena. Demon1 is leaned back in his chair, a look of subdued bitterness and contempt on his face as he watches each of his team mates fall. keznit gets the last kill. The 5 guys holding up a banner begin jumping up and down screaming like maniacs. The rest of the crowd emits a groan of disappointment. Bren and Sideshow proclaim in stunned excitement and pure hype that KRÜ Esports have qualified to Masters Madrid. I wake up feeling content, knowing what’s to come.",1,t3_1ani8t8,t3_1ani8t8,/r/ValorantCompetitive/comments/1ani8t8/6_days_away_from_vct_started_having_nightmares/kpzlbn4/,0,False
kpzkyns,1707685838.0,ValorantCompetitive,speeperr,"I'm excited to see what 100T cook up with Zikz as HC. I think he was part of NRG back when they did that light shield buy that's often called the Fnatic buy now. And him playing a role in EG's success is also great of course. I think there's a world where 100T qualify, but that whole group is insane for anyone to get out of.",1,t3_1aofxht,t3_1aofxht,/r/ValorantCompetitive/comments/1aofxht/romero_zikz_talks_returning_to_100_thieves_as_the/kpzkyns/,0,False
kpzi93q,1707684925.0,ValorantCompetitive,rafaelvicio,"Thank you, looking forward to your feedback.",1,t1_kpwan38,t3_1amzd7t,/r/ValorantCompetitive/comments/1amzd7t/introducing_stattrakgg_an_esports_fantasy_game_we/kpzi93q/,0,True
kpzhr3s,1707684757.0,ValorantCompetitive,[deleted],[removed],1,t1_kpzgnqd,t3_1aoeh6n,/r/ValorantCompetitive/comments/1aoeh6n/vcl_northern_europe_polaris_streams_be_like/kpzhr3s/,0,False
kpza0su,1707682165.0,ValorantCompetitive,Zorronin,romero been grinding,1,t3_1aofxht,t3_1aofxht,/r/ValorantCompetitive/comments/1aofxht/romero_zikz_talks_returning_to_100_thieves_as_the/kpza0su/,0,False
kpz8tmg,1707681763.0,ValorantCompetitive,holyfuckyouaredumb,Asuna crying rn,1,t3_1aofxht,t3_1aofxht,/r/ValorantCompetitive/comments/1aofxht/romero_zikz_talks_returning_to_100_thieves_as_the/kpz8tmg/,0,False
kpz6oxb,1707681053.0,ValorantCompetitive,Western_Strike7468,its so joever,1,t3_1aofxht,t3_1aofxht,/r/ValorantCompetitive/comments/1aofxht/romero_zikz_talks_returning_to_100_thieves_as_the/kpz6oxb/,0,False
kpz3xsn,1707680141.0,ValorantCompetitive,brickyfrog,make it more dynamic like the CS UI's,1,t3_1ao78cn,t3_1ao78cn,/r/ValorantCompetitive/comments/1ao78cn/vct_overlay_wishlist/kpz3xsn/,0,False
