id,created_utc,subreddit,author,body,score,parent_id,link_id,permalink,controversiality,is_submitter
l1pphzj,1714347866.0,ValorantCompetitive,A7URS,"This is disrespectful to prx players, they have controlled chaos, havoc has zero control",1,t1_l1pp39q,t3_1cfkjre,/r/ValorantCompetitive/comments/1cfkjre/cloud9_vs_furia_champions_tour_2024_americas/l1pphzj/,0,False
l1ppgtt,1714347853.0,ValorantCompetitive,WolfgangTheRevenge,"Nzw cant win with these cats man, konan is legit tier 3 player levels of shit

https://preview.redd.it/7ux6ddhk4bxc1.jpeg?width=997&amp;format=pjpg&amp;auto=webp&amp;s=adfd79c26c15cdf82c10346e73173cdd7331b6c3

Also the gameplay was so dogshit man wtf was that????",11,t3_1cfkjre,t3_1cfkjre,/r/ValorantCompetitive/comments/1cfkjre/cloud9_vs_furia_champions_tour_2024_americas/l1ppgtt/,0,False
l1ppgtb,1714347852.0,ValorantCompetitive,nitseb,"You're lost man. TenZ is talking about players who stand still to shoot vs those that keep moving during a duel. He is absolutely wrong also when saying Less stands still when dueling when he is literally known for constantly moving while dueling, that is most of his clips.

What the thread is talking about is when you WANT to stop whether you press the opposite movement key or not, which is just up to preference. You won't miss because of it, you may miss if you keep moving but you are also harder to hit, as Less, Suygetsu and others have shown us on stage.",1,t1_l1pmg6g,t3_1cffezi,/r/ValorantCompetitive/comments/1cffezi/do_you_guys_think_that_less_counterstrafes/l1ppgtb/,0,False
l1ppg5y,1714347845.0,ValorantCompetitive,[deleted],[deleted],3,t3_1cfkjre,t3_1cfkjre,/r/ValorantCompetitive/comments/1cfkjre/cloud9_vs_furia_champions_tour_2024_americas/l1ppg5y/,0,False
l1ppftq,1714347841.0,ValorantCompetitive,KillerKattapa,The prelude is famous when suygetsu started using it and became iconic when he 4k against PRX to win copenhagen.,1,t3_1cfkhl6,t3_1cfkhl6,/r/ValorantCompetitive/comments/1cfkhl6/the_loud_less_effect/l1ppftq/,0,False
l1ppf96,1714347834.0,ValorantCompetitive,irepislam1400,Brother they will just stream and be fine lol,1,t1_l1pm6lk,t3_1cfcjdw,/r/ValorantCompetitive/comments/1cfcjdw/zekken_outlines_why_its_so_hard_for_sentinels_to/l1ppf96/,0,False
l1ppefg,1714347825.0,ValorantCompetitive,Successful-Coconut60,Nba players skip one game when they have 4 in a week. Physically draining games.,1,t1_l1pp92p,t3_1cfcjdw,/r/ValorantCompetitive/comments/1cfcjdw/zekken_outlines_why_its_so_hard_for_sentinels_to/l1ppefg/,0,False
l1ppeg7,1714347825.0,ValorantCompetitive,Jaybarcafan,If NRG lose this I'll ask my crush out.,1,t3_1cffjwf,t3_1cffjwf,/r/ValorantCompetitive/comments/1cffjwf/vct_2024_americas_stage_1_week_4_day_2_live/l1ppeg7/,0,False
l1ppea6,1714347823.0,ValorantCompetitive,NonWeeb,If It came down to my duelist carrying against the worst team in the world I would be mad as well just like you,1,t1_l1pp1fu,t3_1cfkjre,/r/ValorantCompetitive/comments/1cfkjre/cloud9_vs_furia_champions_tour_2024_americas/l1ppea6/,0,False
l1ppeb2,1714347823.0,ValorantCompetitive,Abe1254,Imagine a team like Loud with an Oxy......,1,t1_l1po65k,t3_1cfkjre,/r/ValorantCompetitive/comments/1cfkjre/cloud9_vs_furia_champions_tour_2024_americas/l1ppeb2/,0,False
l1ppdfe,1714347813.0,ValorantCompetitive,IGLJURM23,THEY WON MADRID U DONUT,1,t1_l1pjqwf,t3_1cfcjdw,/r/ValorantCompetitive/comments/1cfcjdw/zekken_outlines_why_its_so_hard_for_sentinels_to/l1ppdfe/,0,False
l1ppddh,1714347813.0,ValorantCompetitive,matteusman,"I saw the clip was only 25 seconds and initially thought, “I hate when people don’t post the full clip”",1,t3_1cf5y5l,t3_1cf5y5l,/r/ValorantCompetitive/comments/1cf5y5l/ban_1v5_clutch/l1ppddh/,0,False
l1ppc8w,1714347800.0,ValorantCompetitive,Gizmobomb,ratio + respect tmv,1,t1_l1pp1fu,t3_1cfkjre,/r/ValorantCompetitive/comments/1cfkjre/cloud9_vs_furia_champions_tour_2024_americas/l1ppc8w/,0,False
l1ppbqq,1714347794.0,ValorantCompetitive,IGLJURM23,Cuz they weren’t being anti stratted to death. This is all of these guys first time having success and being at the top besides sacy who is away from home and tenz who won masters 3 years ago. These guys are humans and just cuz ur a sentinels hater based on the fan base none of these players deserve the hate. You can hate on the fans all u want but don’t invalidate how these guys feel. U can’t compete at their level and u don’t get to tell them how they should or shouldn’t be feeling,1,t1_l1oo5s9,t3_1cfcjdw,/r/ValorantCompetitive/comments/1cfcjdw/zekken_outlines_why_its_so_hard_for_sentinels_to/l1ppbqq/,0,False
l1pp96v,1714347763.0,ValorantCompetitive,LesbianAkali,Im so sorry my sen friends i just wanted sen on playoffs ![img](emote|t5_2g5ach|16110),1,t1_l1porxp,t3_1cfautp,/r/ValorantCompetitive/comments/1cfautp/i_return_with_another_flowchart_for_the_sentinels/l1pp96v/,0,False
l1pp92x,1714347762.0,ValorantCompetitive,lenolalatte,I watched the last like 6 rounds of bind. Were the first two maps just a clown fiesta? I assume so after seeing the scores of both games lmao,1,t3_1cfkjre,t3_1cfkjre,/r/ValorantCompetitive/comments/1cfkjre/cloud9_vs_furia_champions_tour_2024_americas/l1pp92x/,0,False
l1pp92p,1714347762.0,ValorantCompetitive,irepislam1400,Nba players take games off for load management and on top of that stars like LeBron will coast in the regular season often not the best comparison ,1,t1_l1pk3po,t3_1cfcjdw,/r/ValorantCompetitive/comments/1cfcjdw/zekken_outlines_why_its_so_hard_for_sentinels_to/l1pp92p/,0,False
l1pp8wc,1714347760.0,ValorantCompetitive,vaibhav0405,![img](emote|t5_2g5ach|9339)![img](emote|t5_2g5ach|9339),1,t1_l1po77v,t3_1cfkjre,/r/ValorantCompetitive/comments/1cfkjre/cloud9_vs_furia_champions_tour_2024_americas/l1pp8wc/,0,False
l1pp8rw,1714347758.0,ValorantCompetitive,ExcellentPastries,[dude's flair like](https://imgur.com/a/9ZYmOYG),1,t1_l1poaq8,t3_1cfkjre,/r/ValorantCompetitive/comments/1cfkjre/cloud9_vs_furia_champions_tour_2024_americas/l1pp8rw/,0,False
l1pp7f6,1714347743.0,ValorantCompetitive,greensunscreen,with all the stuff the casters were saying I wonder if furia's coach gets canned after the split,1,t3_1cfkjre,t3_1cfkjre,/r/ValorantCompetitive/comments/1cfkjre/cloud9_vs_furia_champions_tour_2024_americas/l1pp7f6/,0,False
l1pp78i,1714347741.0,ValorantCompetitive,[deleted],[deleted],0,t1_l1povhi,t3_1cfkjre,/r/ValorantCompetitive/comments/1cfkjre/cloud9_vs_furia_champions_tour_2024_americas/l1pp78i/,0,False
l1pp6g1,1714347732.0,ValorantCompetitive,vaibhav0405,The only good thing coming out of that game was the lore behind optech pause,1,t3_1cfkjre,t3_1cfkjre,/r/ValorantCompetitive/comments/1cfkjre/cloud9_vs_furia_champions_tour_2024_americas/l1pp6g1/,0,False
l1pp4jw,1714347710.0,ValorantCompetitive,Phylosium,I feel like suygetsu started the prelude+prime karambit+sentinel trend no?,1,t3_1cfkhl6,t3_1cfkhl6,/r/ValorantCompetitive/comments/1cfkhl6/the_loud_less_effect/l1pp4jw/,0,False
l1pp3q1,1714347700.0,ValorantCompetitive,RyomaVT,Same,1,t1_l1po8b0,t3_1cfkjre,/r/ValorantCompetitive/comments/1cfkjre/cloud9_vs_furia_champions_tour_2024_americas/l1pp3q1/,0,False
l1pp39q,1714347695.0,ValorantCompetitive,GullibleHurry470,This mf will actually play well in prx,1,t1_l1po807,t3_1cfkjre,/r/ValorantCompetitive/comments/1cfkjre/cloud9_vs_furia_champions_tour_2024_americas/l1pp39q/,0,False
l1pp2z9,1714347691.0,ValorantCompetitive,TheCatsActually,The first four rounds of Lotus were some of the most entertaining jail Valorant played in Americas this year. If only the rest of the series was as fun.,1,t1_l1po7k9,t3_1cfkjre,/r/ValorantCompetitive/comments/1cfkjre/cloud9_vs_furia_champions_tour_2024_americas/l1pp2z9/,0,False
l1pp2jl,1714347686.0,ValorantCompetitive,BeautifulChocolate87,"Moose is insane also, tbh i feel like xeppaa might be the only weak link ",1,t1_l1pol0o,t3_1cfkjre,/r/ValorantCompetitive/comments/1cfkjre/cloud9_vs_furia_champions_tour_2024_americas/l1pp2jl/,0,False
l1pp1fu,1714347674.0,ValorantCompetitive,TheTurtleOne,Considering his tierlist his analysis is not worth anything anyway,1,t1_l1po77v,t3_1cfkjre,/r/ValorantCompetitive/comments/1cfkjre/cloud9_vs_furia_champions_tour_2024_americas/l1pp1fu/,0,False
l1pp0hf,1714347663.0,ValorantCompetitive,littleindianman12,Imagine saying this as a sen fan who isnt making playoffs lol,1,t1_l1pol67,t3_1cfkjre,/r/ValorantCompetitive/comments/1cfkjre/cloud9_vs_furia_champions_tour_2024_americas/l1pp0hf/,0,False
l1poytc,1714347644.0,ValorantCompetitive,[deleted],[deleted],-3,t1_l1po99v,t3_1cfkjre,/r/ValorantCompetitive/comments/1cfkjre/cloud9_vs_furia_champions_tour_2024_americas/l1poytc/,0,False
l1poygm,1714347639.0,ValorantCompetitive,IGLJURM23,"Everyone handles it differently. So for one team it may not burn them out but for everyone on this sentinels team this is their first real taste of long success besides Sacy who is away from home and Tenz who won a masters 3 years ago. Johnqt is also away from family and only saw them when they won Madrid. These guys played all offseason whereas other teams didn’t even play close to as many games. Stop bitching about them being burnt out and get off ur lazy ass and go win a masters, then we will talk, but until then keep arm chair analyzing and shitting on humans cuz they are part of a team u don’t like",1,t1_l1p1ecf,t3_1cfcjdw,/r/ValorantCompetitive/comments/1cfcjdw/zekken_outlines_why_its_so_hard_for_sentinels_to/l1poygm/,0,False
l1powrf,1714347620.0,ValorantCompetitive,TheCatsActually,I wanna see this kid in a team with actual structure he truly is the future.,1,t1_l1po7tq,t3_1cfkjre,/r/ValorantCompetitive/comments/1cfkjre/cloud9_vs_furia_champions_tour_2024_americas/l1powrf/,0,False
l1povhi,1714347605.0,ValorantCompetitive,Direct_Morning_3223,the mud meme is actually true. They drag everyone to their level. Put prime FNC against them it’s gonna be a brawl.,1,t1_l1po99v,t3_1cfkjre,/r/ValorantCompetitive/comments/1cfkjre/cloud9_vs_furia_champions_tour_2024_americas/l1povhi/,0,False
l1pov48,1714347601.0,ValorantCompetitive,Dalamaduren,Exactly what came to my mind. Of course there are other players that can help him but under Saad this boy could turn into an even bigger menace,1,t1_l1pomfr,t3_1cffjwf,/r/ValorantCompetitive/comments/1cffjwf/vct_2024_americas_stage_1_week_4_day_2_live/l1pov48/,0,False
l1poun2,1714347596.0,ValorantCompetitive,irepislam1400,"What are you talking about? There should be a longer break in between Madrid and the regular season do you disagree with that? If not for preventing Madrid teams from being at a disadvantage, at the bare minimum root should take into account that players will have visa issues ",1,t1_l1pjqwf,t3_1cfcjdw,/r/ValorantCompetitive/comments/1cfcjdw/zekken_outlines_why_its_so_hard_for_sentinels_to/l1poun2/,0,False
l1posw0,1714347576.0,ValorantCompetitive,nterature,"It's not clear, but I would assume it's just because of what [Crws said in the stage interview after the series, since Crws very openly spoke about thinking Secret was being disrespectful to the Talon players in Tagalog.](https://clips.twitch.tv/InterestingFragileSoybeanArsonNoSexy-A4ime3H4LuEwoXsP) 

What Crws said is easily the most high-profile acknowledgment of the beef, so I would assume Vash was referring to that.",1,t1_l1pmupy,t3_1cffyq4,/r/ValorantCompetitive/comments/1cffyq4/summary_of_talon_postmatch_press_conference_talon/l1posw0/,0,True
l2rdv4k,1714953543.0,ValorantCompetitive,daffyduckferraro,"I am rooting for loud so hard I want sen in playoffs

Unless they and 100t both make it to lowers and sen beat 100t then I will be sad",1,t3_1ckzzq7,t3_1ckzzq7,/r/ValorantCompetitive/comments/1ckzzq7/vct_2024_americas_stage_1_week_5_day_3_live/l2rdv4k/,0,False
l2rdufv,1714953534.0,ValorantCompetitive,QuestionablePotato42,"The narrative that surrounds C9 currently is that they ""catch teams during their down swing"", often citing the absolute stomp witnessed at the hands of 100T. Rather than use that as a validation of 100T improvement, its a slight against C9 and their supposed luck.

At the VERY least, C9 beat teams that beat NRG and SEN, the supposed TOP TEAMS up until recently. I agree that it's hard to be confident in them when their games are this sloppy, but you can't look at the results and say its all luck or timing.",1,t1_l2r7np4,t3_1cl4aj0,/r/ValorantCompetitive/comments/1cl4aj0/cloud9_vs_mibr_champions_tour_2024_americas_stage/l2rdufv/,0,False
l2rdtuy,1714953528.0,ValorantCompetitive,Zealousideal-Pain-97,Ok someone tell jonahp skye has been reworked and the flashes dont recharge anymore,1,t3_1ckzzq7,t3_1ckzzq7,/r/ValorantCompetitive/comments/1ckzzq7/vct_2024_americas_stage_1_week_5_day_3_live/l2rdtuy/,0,False
l2rdt7a,1714953520.0,ValorantCompetitive,ghostking4444,Honestly that’s nothing,1,t1_l2r7u09,t3_1cl4aj0,/r/ValorantCompetitive/comments/1cl4aj0/cloud9_vs_mibr_champions_tour_2024_americas_stage/l2rdt7a/,0,False
l2rds13,1714953506.0,ValorantCompetitive,Pojobob,What....? What does NRG have to do with this lol,1,t1_l2rdowa,t3_1ckzzq7,/r/ValorantCompetitive/comments/1ckzzq7/vct_2024_americas_stage_1_week_5_day_3_live/l2rds13/,0,False
l2rdqod,1714953490.0,ValorantCompetitive,funessed,EG playoff chances resting on G2 is tragic. G2 look lost,1,t3_1ckzzq7,t3_1ckzzq7,/r/ValorantCompetitive/comments/1ckzzq7/vct_2024_americas_stage_1_week_5_day_3_live/l2rdqod/,0,False
l2rdowa,1714953467.0,ValorantCompetitive,NeimannSmith,Wait this shit might genuinely happen. NRG boutta piss me off even more. NOT EVEN ONE MAP????,1,t3_1ckzzq7,t3_1ckzzq7,/r/ValorantCompetitive/comments/1ckzzq7/vct_2024_americas_stage_1_week_5_day_3_live/l2rdowa/,0,False
l2rdhup,1714953382.0,ValorantCompetitive,sky_____god,Saadhaak crouched tying his bloody shoelaces 🔥🔥🔥🗣️,1,t3_1ckzzq7,t3_1ckzzq7,/r/ValorantCompetitive/comments/1ckzzq7/vct_2024_americas_stage_1_week_5_day_3_live/l2rdhup/,0,False
l2rdfft,1714953353.0,ValorantCompetitive,Zealousideal-Pain-97,No genuinely he flashed 1 guy that round,1,t1_l2rd8ka,t3_1ckzzq7,/r/ValorantCompetitive/comments/1ckzzq7/vct_2024_americas_stage_1_week_5_day_3_live/l2rdfft/,0,False
l2rde9p,1714953339.0,ValorantCompetitive,AegonThe241st,Aspas 1.77 KD wtf,1,t3_1cl4c8q,t3_1cl4c8q,/r/ValorantCompetitive/comments/1cl4c8q/oxy_averages_300_acs_over_the_whole_first_split/l2rde9p/,0,False
l2rd9oy,1714953283.0,ValorantCompetitive,sui_ast,what did they say lol,1,t1_l2rc5t8,t3_1ckzzq7,/r/ValorantCompetitive/comments/1ckzzq7/vct_2024_americas_stage_1_week_5_day_3_live/l2rd9oy/,0,False
l2rd9dx,1714953280.0,ValorantCompetitive,GoldClassGaming,Your flair makes your comment really funny,1,t1_l2rchv2,t3_1cl4c8q,/r/ValorantCompetitive/comments/1cl4c8q/oxy_averages_300_acs_over_the_whole_first_split/l2rd9dx/,0,False
l2rd8ka,1714953269.0,ValorantCompetitive,Zealousideal-Pain-97,JonahP dookie ass flashes,1,t3_1ckzzq7,t3_1ckzzq7,/r/ValorantCompetitive/comments/1ckzzq7/vct_2024_americas_stage_1_week_5_day_3_live/l2rd8ka/,0,False
l2rd7rl,1714953260.0,ValorantCompetitive,Informal-Throat-8646,"They're definitely a LOT more risky than other teams, but like I said it's hard to cut that off when in reality that same riskiness has won them as many if not more rounds than it's lost them",1,t1_l2rcqxo,t3_1cl4aj0,/r/ValorantCompetitive/comments/1cl4aj0/cloud9_vs_mibr_champions_tour_2024_americas_stage/l2rd7rl/,0,False
l2rd5s2,1714953234.0,ValorantCompetitive,RedXWasHere,"This is double edged. historically we have prequalifed teams, and with those not having a last chance, a reset. Here we don't, it makes sense to have the entire season in consideration for champs, but it means teams like NRG, Sentinels, Loud, EG etc don't get a chance to reset properly",1,t3_1ckzlk5,t3_1ckzlk5,/r/ValorantCompetitive/comments/1ckzlk5/what_is_this_true/l2rd5s2/,0,False
l2rd45n,1714953215.0,ValorantCompetitive,Jon_on_the_snow,"&gt;I kept expecting this kid to suck because it was highly upvoted.

Maybe you need to watch the games instead of just reading comments mate",1,t1_l2r87kx,t3_1cl4c8q,/r/ValorantCompetitive/comments/1cl4c8q/oxy_averages_300_acs_over_the_whole_first_split/l2rd45n/,0,False
l2rczoo,1714953159.0,ValorantCompetitive,omaewakusuyaro,It feels like loud went for a kind of known player with qck instead of going for a rank demon like they did with aspas(im totally making this up btw idk where did aspass come from),1,t1_l2rc3sn,t3_1ckzzq7,/r/ValorantCompetitive/comments/1ckzzq7/vct_2024_americas_stage_1_week_5_day_3_live/l2rczoo/,0,False
l2rcz2h,1714953152.0,ValorantCompetitive,Grenji05,ok loud lock the fuck in no more rounds dropped,1,t3_1ckzzq7,t3_1ckzzq7,/r/ValorantCompetitive/comments/1ckzzq7/vct_2024_americas_stage_1_week_5_day_3_live/l2rcz2h/,0,False
l2rcw5g,1714953117.0,ValorantCompetitive,RedXWasHere,@steel you have some experience in this I hear,1,t1_l2rc8eo,t3_1ckzzq7,/r/ValorantCompetitive/comments/1ckzzq7/vct_2024_americas_stage_1_week_5_day_3_live/l2rcw5g/,0,False
l2rcuj8,1714953098.0,ValorantCompetitive,RedXWasHere,I root loud until G2 gets 14 rounds then I root G2 for EG,1,t3_1ckzzq7,t3_1ckzzq7,/r/ValorantCompetitive/comments/1ckzzq7/vct_2024_americas_stage_1_week_5_day_3_live/l2rcuj8/,0,False
l2rcqxo,1714953055.0,ValorantCompetitive,QuestionablePotato42,"Maybe ""measured"" is the word we should use when discussing it. There are times when its ok to let your wild aggro players off the leash, and times when it's important to play smart and safe. With this roster sometimes it just feels like its EVERY time.",1,t1_l2rc4wy,t3_1cl4aj0,/r/ValorantCompetitive/comments/1cl4aj0/cloud9_vs_mibr_champions_tour_2024_americas_stage/l2rcqxo/,0,False
l2rco21,1714953021.0,ValorantCompetitive,HoneyChilliPotato7,Getting banned from competitive play forever is a valid reason imo,1,t1_l2rc8eo,t3_1ckzzq7,/r/ValorantCompetitive/comments/1ckzzq7/vct_2024_americas_stage_1_week_5_day_3_live/l2rco21/,0,False
l2rcnol,1714953016.0,ValorantCompetitive,IAMJUX,Them getting booted out of franchising is stopping it,1,t1_l2rc8eo,t3_1ckzzq7,/r/ValorantCompetitive/comments/1ckzzq7/vct_2024_americas_stage_1_week_5_day_3_live/l2rcnol/,0,False
l2rcmwo,1714953006.0,ValorantCompetitive,Sciipi,No this match didn’t affect SEN playoff chances at all,1,t1_l2rc5k4,t3_1cl4aj0,/r/ValorantCompetitive/comments/1cl4aj0/cloud9_vs_mibr_champions_tour_2024_americas_stage/l2rcmwo/,0,False
l2rcj7d,1714952961.0,ValorantCompetitive,AegonThe241st,"no more stupid single elim shit, no more meta changes 2 weeks before the season starts, no more mickey mouse 8 team international tournaments, a proper league system, don't punish teams for going to internationals, spread the season out, don't use formats that can't work with an odd number of teams",1,t1_l2r9j3h,t3_1ckzlk5,/r/ValorantCompetitive/comments/1ckzlk5/what_is_this_true/l2rcj7d/,0,False
l2rchv2,1714952945.0,ValorantCompetitive,Particular_Fee_9262,"I actually don't think the vlr rating is all that good and isn't as reliable as ACS. also, I think ACS is flawed too. I think eyetest is the best measurement of a player's skill and you can use stats to back up claims if necessary. but yeah, OXY has been insane. 300 ACS across 336 rounds is ridiculous.",1,t3_1cl4c8q,t3_1cl4c8q,/r/ValorantCompetitive/comments/1cl4c8q/oxy_averages_300_acs_over_the_whole_first_split/l2rchv2/,0,False
l2rceqq,1714952908.0,ValorantCompetitive,MakimaGOAT,what a stinky format,1,t3_1ckzlk5,t3_1ckzlk5,/r/ValorantCompetitive/comments/1ckzlk5/what_is_this_true/l2rceqq/,0,False
l2rce1y,1714952899.0,ValorantCompetitive,numry,competitive integrity?,1,t1_l2rc8eo,t3_1ckzzq7,/r/ValorantCompetitive/comments/1ckzzq7/vct_2024_americas_stage_1_week_5_day_3_live/l2rce1y/,0,False
l2rcdxi,1714952898.0,ValorantCompetitive,omaewakusuyaro,Only lil bitches do that. I geniuly dont believe saadhak is one of them,1,t1_l2rc8eo,t3_1ckzzq7,/r/ValorantCompetitive/comments/1ckzzq7/vct_2024_americas_stage_1_week_5_day_3_live/l2rcdxi/,0,False
l2rccm9,1714952882.0,ValorantCompetitive,Huldmer,ESIC lmfao,1,t1_l2rc8eo,t3_1ckzzq7,/r/ValorantCompetitive/comments/1ckzzq7/vct_2024_americas_stage_1_week_5_day_3_live/l2rccm9/,0,False
l2rcaz3,1714952861.0,ValorantCompetitive,Zealousideal-Pain-97,Competitive integrity?,1,t1_l2rc8eo,t3_1ckzzq7,/r/ValorantCompetitive/comments/1ckzzq7/vct_2024_americas_stage_1_week_5_day_3_live/l2rcaz3/,0,False
l2rc8eo,1714952831.0,ValorantCompetitive,SonnyYT,Wait unironically what’s stopping loud and G2 just making a deal to let each other qual,1,t3_1ckzzq7,t3_1ckzzq7,/r/ValorantCompetitive/comments/1ckzzq7/vct_2024_americas_stage_1_week_5_day_3_live/l2rc8eo/,0,False
l2rc7bs,1714952817.0,ValorantCompetitive,Aesion,"Sorry, whats up with the caster dissing Qck? I've never seen this before lol",1,t3_1ckzzq7,t3_1ckzzq7,/r/ValorantCompetitive/comments/1ckzzq7/vct_2024_americas_stage_1_week_5_day_3_live/l2rc7bs/,0,False
l2rc5t8,1714952799.0,ValorantCompetitive,HoneyChilliPotato7,G2 looking too good. GGs SEN,1,t3_1ckzzq7,t3_1ckzzq7,/r/ValorantCompetitive/comments/1ckzzq7/vct_2024_americas_stage_1_week_5_day_3_live/l2rc5t8/,0,False
l2rc5k4,1714952796.0,ValorantCompetitive,QueenShakey34,okay so this means SEN don't make playoffs right? Didn't C9 need to lose for that to happen?,1,t3_1cl4aj0,t3_1cl4aj0,/r/ValorantCompetitive/comments/1cl4aj0/cloud9_vs_mibr_champions_tour_2024_americas_stage/l2rc5k4/,0,False
l2rc4wy,1714952789.0,ValorantCompetitive,Informal-Throat-8646,"It's one of those where it's better to do it together, you'd rather see them doing these pushes together rather than solo 

C9 have always had a more aggro playstyle though, its how they manage to catch so many teams out",1,t1_l2raze0,t3_1cl4aj0,/r/ValorantCompetitive/comments/1cl4aj0/cloud9_vs_mibr_champions_tour_2024_americas_stage/l2rc4wy/,0,False
l2rc4eh,1714952783.0,ValorantCompetitive,IAMJUX,It's over for SEN,1,t3_1ckzzq7,t3_1ckzzq7,/r/ValorantCompetitive/comments/1ckzzq7/vct_2024_americas_stage_1_week_5_day_3_live/l2rc4eh/,0,False
l2rc3tz,1714952776.0,ValorantCompetitive,NeimannSmith,This round counting is brutal man.,1,t3_1ckzzq7,t3_1ckzzq7,/r/ValorantCompetitive/comments/1ckzzq7/vct_2024_americas_stage_1_week_5_day_3_live/l2rc3tz/,0,False
l2rc3sn,1714952775.0,ValorantCompetitive,Extreme-Scientist-83,Lmaoooo qck moment this team is doomed,1,t3_1ckzzq7,t3_1ckzzq7,/r/ValorantCompetitive/comments/1ckzzq7/vct_2024_americas_stage_1_week_5_day_3_live/l2rc3sn/,0,False
l2rc3la,1714952773.0,ValorantCompetitive,ColdIron27,"As a Sen fan, I think sen shouldn't qualify. It will suck to not see them play for a few months, but the current rate at which they play games is unsustainable. 

There's just so much footage of their gameplay, and they don't have the time to practice and reinvent themselves.

As much as I want to see Sen on top, in the grand scheme of things, skipping Shanghai might be what they need to regain their footing.",1,t3_1cklegi,t3_1cklegi,/r/ValorantCompetitive/comments/1cklegi/sen_can_qualify_but_plat_chat_has_other_plans/l2rc3la/,0,False
l2rc1tp,1714952752.0,ValorantCompetitive,Zealousideal-Pain-97,Leaf too,1,t1_l2rc19f,t3_1ckzzq7,/r/ValorantCompetitive/comments/1ckzzq7/vct_2024_americas_stage_1_week_5_day_3_live/l2rc1tp/,0,False
l2rc19f,1714952745.0,ValorantCompetitive,Zealousideal-Pain-97,Wow this trent guy is lowkey good,1,t3_1ckzzq7,t3_1ckzzq7,/r/ValorantCompetitive/comments/1ckzzq7/vct_2024_americas_stage_1_week_5_day_3_live/l2rc19f/,0,False
l2rbzp4,1714952727.0,ValorantCompetitive,evan_flow_,"Yeah Oxy was a tier 2 GOAT, even before G2. He was a beast with Dark Ratio. Oxy was inevitable",1,t1_l2r96yy,t3_1cl4c8q,/r/ValorantCompetitive/comments/1cl4c8q/oxy_averages_300_acs_over_the_whole_first_split/l2rbzp4/,0,False
l2rbv1b,1714952669.0,ValorantCompetitive,PhysicalAd8765,I actually want LOUD to win this ngl. I still think they’re better/ more reliable than EG rn so I’d rather them in playoffs.,1,t3_1ckzzq7,t3_1ckzzq7,/r/ValorantCompetitive/comments/1ckzzq7/vct_2024_americas_stage_1_week_5_day_3_live/l2rbv1b/,0,False
l2rbkxe,1714952546.0,ValorantCompetitive,AegonThe241st,Don't MIBR have bzka and Frod? Both proven good coaches,1,t1_l2ra50r,t3_1cl4aj0,/r/ValorantCompetitive/comments/1cl4aj0/cloud9_vs_mibr_champions_tour_2024_americas_stage/l2rbkxe/,0,False
l2rbig6,1714952515.0,ValorantCompetitive,NeimannSmith,12 more rounds combined.,1,t3_1ckzzq7,t3_1ckzzq7,/r/ValorantCompetitive/comments/1ckzzq7/vct_2024_americas_stage_1_week_5_day_3_live/l2rbig6/,0,False
l2rbfmp,1714952481.0,ValorantCompetitive,EkanshNehra,This is about to be the funniest live thread of all time,1,t3_1ckzzq7,t3_1ckzzq7,/r/ValorantCompetitive/comments/1ckzzq7/vct_2024_americas_stage_1_week_5_day_3_live/l2rbfmp/,0,False
l2rb8m2,1714952397.0,ValorantCompetitive,Grenji05,OH SEVENNN,1,t3_1ckzzq7,t3_1ckzzq7,/r/ValorantCompetitive/comments/1ckzzq7/vct_2024_americas_stage_1_week_5_day_3_live/l2rb8m2/,0,False
l2rb1r7,1714952315.0,ValorantCompetitive,juniorjaw,"The absolute cinema is that Icebox is said by RazorLanguage who is all about dumbing down sentences for people to understand easily. Bro tried to cook something simple. Can't get more easy than ""Icebox"".",1,t3_1ckx3qu,t3_1ckx3qu,/r/ValorantCompetitive/comments/1ckx3qu/the_most_perceptive_conversation_about_the/l2rb1r7/,0,False
l2raze0,1714952287.0,ValorantCompetitive,QuestionablePotato42,"Yeah that's fair, but it's not just OXY. Sometimes its more of the team. Usually xeppaa.",1,t1_l2rapav,t3_1cl4aj0,/r/ValorantCompetitive/comments/1cl4aj0/cloud9_vs_mibr_champions_tour_2024_americas_stage/l2raze0/,0,False
l2raxno,1714952265.0,ValorantCompetitive,Cablek26,"it’s cooked for sen gg

hope for a 2-1 loud win tho 🙏",1,t3_1ckzzq7,t3_1ckzzq7,/r/ValorantCompetitive/comments/1ckzzq7/vct_2024_americas_stage_1_week_5_day_3_live/l2raxno/,0,False
l2ratx1,1714952220.0,ValorantCompetitive,RedXWasHere,The second G2 hits 14 rounds I root for them to send EG to playoffs,1,t3_1ckzzq7,t3_1ckzzq7,/r/ValorantCompetitive/comments/1ckzzq7/vct_2024_americas_stage_1_week_5_day_3_live/l2ratx1/,0,False
