id,created_utc,subreddit,author,body,score,parent_id,link_id,permalink,controversiality,is_submitter
kgt5hsh,1704671353.0,ValorantCompetitive,ANewHeaven1,"I def think those two (FNS and Saadhak) are the two best IGLs in Val history and very comparable players, can’t really be upset with either",1,t1_kgsqoid,t3_190ypuq,/r/ValorantCompetitive/comments/190ypuq/saadhak_reacts_to_the_lev_situation_and_loud/kgt5hsh/,0,False
kgt3v13,1704670837.0,ValorantCompetitive,vnNinja21,-Wolfen +Wolfen,1,t3_190zavm,t3_190zavm,/r/ValorantCompetitive/comments/190zavm/new_case_esports_valorant_roster/kgt3v13/,0,False
kgt3tff,1704670822.0,ValorantCompetitive,mileseverett,Stewie did the same thing in csgo. Grinded until he got to the top and then took his foot off the pedal and fell off,1,t1_kgrrim2,t3_190moai,/r/ValorantCompetitive/comments/190moai/autimatic_revealed_why_he_left_t1_valorant/kgt3tff/,0,False
kgt2nje,1704670451.0,ValorantCompetitive,TheyDidLizFilthy,actual most asinine comment i’ve seen all week holy fuck,1,t1_kgsxckz,t3_190zckz,/r/ValorantCompetitive/comments/190zckz/every_valorant_champions_winner_ranked_by_acs_and/kgt2nje/,0,False
kgt13zd,1704669956.0,ValorantCompetitive,Dazzling_Rub3525,Acend won the regional masters too.,1,t1_kgsqfxa,t3_190zckz,/r/ValorantCompetitive/comments/190zckz/every_valorant_champions_winner_ranked_by_acs_and/kgt13zd/,0,False
kgt0e9h,1704669728.0,ValorantCompetitive,WolfgangTheRevenge,"As of right now, absolutelly but i realy can make an argument about him having an ass team. In 2023 his best player by far was s0m, his super duelist EU import was dogshit and ghosted on important matches and Vic and Crashies were inconsistent af. Saadhak had Less and Aspas 2 hardcarries while also having Tuyz and Cauanzin which were mediocre at worst and insane at best.",1,t1_kgszk5b,t3_190ypuq,/r/ValorantCompetitive/comments/190ypuq/saadhak_reacts_to_the_lev_situation_and_loud/kgt0e9h/,0,False
kgszk5b,1704669461.0,ValorantCompetitive,Western_Strike7468,im the biggest fenis throater in the world but i think we have to admit Saadhak clears,1,t1_kgsmf5u,t3_190ypuq,/r/ValorantCompetitive/comments/190ypuq/saadhak_reacts_to_the_lev_situation_and_loud/kgszk5b/,0,False
kgsxckz,1704668754.0,ValorantCompetitive,WolfgangTheRevenge,"Nah LOUD as a whole choked Lock-In vic, Crashies and Fenis were omega griefing finals lmao. They werent playing good at all",1,t1_kgsske1,t3_190zckz,/r/ValorantCompetitive/comments/190zckz/every_valorant_champions_winner_ranked_by_acs_and/kgsxckz/,0,False
kgswvbu,1704668604.0,ValorantCompetitive,WolfgangTheRevenge,Actual most stupid comment ive see this week holy fuck,1,t1_kgsf2jt,t3_190ypuq,/r/ValorantCompetitive/comments/190ypuq/saadhak_reacts_to_the_lev_situation_and_loud/kgswvbu/,0,False
kgswmx8,1704668529.0,ValorantCompetitive,WolfgangTheRevenge,Actual living rent free lmfao,1,t1_kgsup32,t3_190zckz,/r/ValorantCompetitive/comments/190zckz/every_valorant_champions_winner_ranked_by_acs_and/kgswmx8/,0,False
kgswaat,1704668418.0,ValorantCompetitive,sky_blu,"Historically Saadhak has definitely been a bit underrated but was the loud roster itself really underated? Consistently the expectation was for them to be one of the best but not win which is exactly what they did. 

I don't doubt loud has the ability to find success without aspas but it feels unfair to have current expectations be aligned with previous ones after losing the best Jett in the game.",1,t3_190ypuq,t3_190ypuq,/r/ValorantCompetitive/comments/190ypuq/saadhak_reacts_to_the_lev_situation_and_loud/kgswaat/,0,False
kgsvugs,1704668278.0,ValorantCompetitive,TheFestusEzeli,"If you go back, Kiles actually overperformed compared to his past couple tournaments in Champions. He was worse in both Masters 3 and Challengers Finals 3",1,t1_kgsk73a,t3_190zckz,/r/ValorantCompetitive/comments/190zckz/every_valorant_champions_winner_ranked_by_acs_and/kgsvugs/,0,False
kgsv43v,1704668051.0,ValorantCompetitive,TheFestusEzeli,Kiles was genuinely awful for Acend for most of 2021. He has been a lot better but he fragged like Bonkar without the great IGLing for a lot of the year,1,t1_kgsikw0,t3_190zckz,/r/ValorantCompetitive/comments/190zckz/every_valorant_champions_winner_ranked_by_acs_and/kgsv43v/,0,False
kgsuz87,1704668011.0,ValorantCompetitive,Razur,"I hooe the hall would include more than just players. It'd be cool to celebrate broadcast talent and staff as well. (Graphics operator, producer, etc)",1,t3_18zeq7g,t3_18zeq7g,/r/ValorantCompetitive/comments/18zeq7g/riot_announced_their_hall_of_fame_for_lol_called/kgsuz87/,0,False
kgsup32,1704667924.0,ValorantCompetitive,wegivesiima,One tournament wonders and still more trophies than prx![img](emote|t5_2g5ach|9339),1,t1_kgsqfxa,t3_190zckz,/r/ValorantCompetitive/comments/190zckz/every_valorant_champions_winner_ranked_by_acs_and/kgsup32/,0,False
kgstn6p,1704667602.0,ValorantCompetitive,Razur,Why is the true answer so far down? smh,1,t1_kgposcn,t3_190ol0n,/r/ValorantCompetitive/comments/190ol0n/what_vct_player_copied_5_times_would_make_the/kgstn6p/,0,False
kgsske1,1704667268.0,ValorantCompetitive,JuninhoLuis,"&gt;Yay wouldve won champs have Victor, Fenis and Crashies not griefed him and Marved in finals😔

Aspas wouldve won LOCK IN have tuyz, Saadahak and cauanzin not griefed him and Less in finals :(   


Fnatic still goated tho -q   


(meme ofc)",1,t1_kgs75kk,t3_190zckz,/r/ValorantCompetitive/comments/190zckz/every_valorant_champions_winner_ranked_by_acs_and/kgsske1/,0,False
kgsrtu9,1704667032.0,ValorantCompetitive,JuninhoLuis,"Doubting Loud for losing Aspas taking into account FNC, NRG, LEV and PRX ? Trully beliavable and reasonable. 

Doubting Loud for losing Aspas when taking into account Navi, Sen, G2, etc? Sorry, but a enormous shup up and be logical about that. Some of these teams didn't even qualified for their regional playoffs this year.",1,t3_190ypuq,t3_190ypuq,/r/ValorantCompetitive/comments/190ypuq/saadhak_reacts_to_the_lev_situation_and_loud/kgsrtu9/,0,False
kgsr0ga,1704666766.0,ValorantCompetitive,TheyDidLizFilthy,"LOL

https://preview.redd.it/l4owvushh3bc1.jpeg?width=1420&amp;format=pjpg&amp;auto=webp&amp;s=0ef47797368fa0451541b6a0f93376502e764fd7",-11,t1_kgspki6,t3_190ypuq,/r/ValorantCompetitive/comments/190ypuq/saadhak_reacts_to_the_lev_situation_and_loud/kgsr0ga/,0,False
kgsqv4a,1704666718.0,ValorantCompetitive,JuninhoLuis,"I get that, but it's kinda different weights here.   


I'm not saying that Loud should be placed higher than NRG and Lev (Americas reference), but common, being put under G2, Sen and whatever else? ofc non sense.",1,t1_kgsewxj,t3_190ypuq,/r/ValorantCompetitive/comments/190ypuq/saadhak_reacts_to_the_lev_situation_and_loud/kgsqv4a/,0,False
kgsqp8z,1704666667.0,ValorantCompetitive,mrbow,!remindme 90 days,1,t1_kgsf2jt,t3_190ypuq,/r/ValorantCompetitive/comments/190ypuq/saadhak_reacts_to_the_lev_situation_and_loud/kgsqp8z/,0,False
kgsqoid,1704666660.0,ValorantCompetitive,WolfgangTheRevenge,Could make a big ass argument about fenis and how he had a pretty shit team on 2023,1,t1_kgsj42c,t3_190ypuq,/r/ValorantCompetitive/comments/190ypuq/saadhak_reacts_to_the_lev_situation_and_loud/kgsqoid/,0,False
kgsqih9,1704666605.0,ValorantCompetitive,Jon_on_the_snow,"I dont think we should call it wrong, but the way they went about it was wrong.

They hired sacy and pancada to be star smokes and inicator players, with a sentinel IGL in dephh

Then they fucked around with the roster by hiring marved, putting him on IGL, cutting sykko out of nowhere. What they are doing now, using the off season to make chages, is the right way. Mucking about during the offseason and shuffling roles all the time is dumb",1,t1_kgsigv2,t3_190j7yd,/r/ValorantCompetitive/comments/190j7yd/some_more_answers_from_minis_ama/kgsqih9/,0,False
kgsqhc3,1704666594.0,ValorantCompetitive,RemindMeBot,"I will be messaging you in 2 months on [**2024-03-07 22:28:56 UTC**](http://www.wolframalpha.com/input/?i=2024-03-07%2022:28:56%20UTC%20To%20Local%20Time) to remind you of [**this link**](https://www.reddit.com/r/ValorantCompetitive/comments/190ypuq/saadhak_reacts_to_the_lev_situation_and_loud/kgsqb1h/?context=3)

[**CLICK THIS LINK**](https://www.reddit.com/message/compose/?to=RemindMeBot&amp;subject=Reminder&amp;message=%5Bhttps%3A%2F%2Fwww.reddit.com%2Fr%2FValorantCompetitive%2Fcomments%2F190ypuq%2Fsaadhak_reacts_to_the_lev_situation_and_loud%2Fkgsqb1h%2F%5D%0A%0ARemindMe%21%202024-03-07%2022%3A28%3A56%20UTC) to send a PM to also be reminded and to reduce spam.

^(Parent commenter can ) [^(delete this message to hide from others.)](https://www.reddit.com/message/compose/?to=RemindMeBot&amp;subject=Delete%20Comment&amp;message=Delete%21%20190ypuq)

*****

|[^(Info)](https://www.reddit.com/r/RemindMeBot/comments/e1bko7/remindmebot_info_v21/)|[^(Custom)](https://www.reddit.com/message/compose/?to=RemindMeBot&amp;subject=Reminder&amp;message=%5BLink%20or%20message%20inside%20square%20brackets%5D%0A%0ARemindMe%21%20Time%20period%20here)|[^(Your Reminders)](https://www.reddit.com/message/compose/?to=RemindMeBot&amp;subject=List%20Of%20Reminders&amp;message=MyReminders%21)|[^(Feedback)](https://www.reddit.com/message/compose/?to=Watchful1&amp;subject=RemindMeBot%20Feedback)|
|-|-|-|-|",1,t1_kgsqb1h,t3_190ypuq,/r/ValorantCompetitive/comments/190ypuq/saadhak_reacts_to_the_lev_situation_and_loud/kgsqhc3/,0,False
kgsqfxa,1704666581.0,ValorantCompetitive,WolfgangTheRevenge,"Actual one tournament wonders, starxo was mid on KOI and Zeek was ![img](emote|t5_2g5ach|9339) on heretics",1,t1_kgsit6x,t3_190zckz,/r/ValorantCompetitive/comments/190zckz/every_valorant_champions_winner_ranked_by_acs_and/kgsqfxa/,0,False
kgsqb1h,1704666536.0,ValorantCompetitive,TheyDidLizFilthy,remindme! 2 months,1,t1_kgsq7ui,t3_190ypuq,/r/ValorantCompetitive/comments/190ypuq/saadhak_reacts_to_the_lev_situation_and_loud/kgsqb1h/,0,False
kgsq96w,1704666520.0,ValorantCompetitive,EntertainmentFluffy,forsaken leaf zellsis zekken,1,t3_190ol0n,t3_190ol0n,/r/ValorantCompetitive/comments/190ol0n/what_vct_player_copied_5_times_would_make_the/kgsq96w/,0,False
kgsq7ui,1704666506.0,ValorantCompetitive,MacarioPro,"If you watch the video he says, by the same metric, Cned, Cloud and KangKang were ahead in the list, this is not a perfect measurement by any mean. 

PS: will be waiting for you apology in march, but to speed thing up I will choose the charity now: any animal protection charity, in honor of aspas plushies.",1,t1_kgsf2jt,t3_190ypuq,/r/ValorantCompetitive/comments/190ypuq/saadhak_reacts_to_the_lev_situation_and_loud/kgsq7ui/,0,True
kgsq75o,1704666500.0,ValorantCompetitive,JuninhoLuis,"Doubting Loud for losing Aspas? Trully beliavable. When you have FNC, NRG, LEV and PRX into account.   


Doubting Loud for losing Aspas when taking into account Navi, Sen, G2, etc? Sorry, but a enormous shup up and be logical about that.",1,t1_kgrwbtt,t3_190ypuq,/r/ValorantCompetitive/comments/190ypuq/saadhak_reacts_to_the_lev_situation_and_loud/kgsq75o/,0,False
kgsptb9,1704666373.0,ValorantCompetitive,Evan_Veet,They beat some of the best teams at the tournament. Don’t call it Mickey Mouse if they were beating the people you wouldn’t say are frauds if they had won,1,t1_kgry1n5,t3_190zckz,/r/ValorantCompetitive/comments/190zckz/every_valorant_champions_winner_ranked_by_acs_and/kgsptb9/,0,False
kgspki6,1704666293.0,ValorantCompetitive,JuninhoLuis,"The weakest Sentinels fan.   


Funny as always.",1,t1_kgsf2jt,t3_190ypuq,/r/ValorantCompetitive/comments/190ypuq/saadhak_reacts_to_the_lev_situation_and_loud/kgspki6/,0,False
kgsondi,1704665994.0,ValorantCompetitive,EuneaL,What a great way to block off your whole team if you misplace it,1,t3_18zfkw0,t3_18zfkw0,/r/ValorantCompetitive/comments/18zfkw0/deadlock_is_receiving_multiple_buffs_barrier_mesh/kgsondi/,0,False
kgsmf5u,1704665262.0,ValorantCompetitive,WolfgangTheRevenge,Always been a LOUD fan (except when they beat OPTIC at champs lmao) not trusting in Saadhak is dumb when hes been on par with Fenis,1,t1_kgrwlk3,t3_190ypuq,/r/ValorantCompetitive/comments/190ypuq/saadhak_reacts_to_the_lev_situation_and_loud/kgsmf5u/,0,False
kgsm5xc,1704665179.0,ValorantCompetitive,JheinLAS,"Saadhak started in Overwatch, nzr started in Smite.  
Then Saadhak moved to paladins, won everything and after they heard the news about Riot making a new fps, they both started playing forming a team, playing CS to learn the fundamentals (nzr was already very good at cs and played with most pros from the scene, although saadhak never played it before). So when valorant came out, they already had a core and thats why they swept everyone.",1,t1_kgsessy,t3_190ypuq,/r/ValorantCompetitive/comments/190ypuq/saadhak_reacts_to_the_lev_situation_and_loud/kgsm5xc/,0,False
kgsk73a,1704664527.0,ValorantCompetitive,Lqtor,"I don’t deny that his performance recently weren’t impressive, but he was at best dead weight during acend’s championship run. The stats honestly make him look better than he actually was because I can’t recall a single moment in that in entire tournament in which he did something notable.",1,t1_kgsikw0,t3_190zckz,/r/ValorantCompetitive/comments/190zckz/every_valorant_champions_winner_ranked_by_acs_and/kgsk73a/,0,False
kgsj42c,1704664175.0,ValorantCompetitive,ANewHeaven1,"saadhak is the best IGL this game has seen so far, never count him out",1,t1_kgru2mk,t3_190ypuq,/r/ValorantCompetitive/comments/190ypuq/saadhak_reacts_to_the_lev_situation_and_loud/kgsj42c/,0,False
kgsj1vt,1704664155.0,ValorantCompetitive,Intrepid-Tank-3414,Annual events to start out the new season generally tends to be a year apart.,1,t1_kgosqj6,t3_190hmq9,/r/ValorantCompetitive/comments/190hmq9/ludwig_tarik_invitational_happening_next_weekend/kgsj1vt/,0,False
kgsj055,1704664139.0,ValorantCompetitive,ANewHeaven1,"nzr being originally on LOUD is interesting - if I'm not mistaken, v1xen was also supposed to be originally on LOUD before pANcada, as before LOUD both Less and pANcada were not known quantities. Pretty interesting.",1,t3_190ypuq,t3_190ypuq,/r/ValorantCompetitive/comments/190ypuq/saadhak_reacts_to_the_lev_situation_and_loud/kgsj055/,0,False
kgsit6x,1704664075.0,ValorantCompetitive,yoavtrachtman,zeek and starxo were really good during the playoffs,1,t1_kgs6k8p,t3_190zckz,/r/ValorantCompetitive/comments/190zckz/every_valorant_champions_winner_ranked_by_acs_and/kgsit6x/,0,True
kgsikw0,1704663999.0,ValorantCompetitive,yoavtrachtman,He’s a really good player what are you on,1,t1_kgsbijo,t3_190zckz,/r/ValorantCompetitive/comments/190zckz/every_valorant_champions_winner_ranked_by_acs_and/kgsikw0/,0,True
kgsigv2,1704663962.0,ValorantCompetitive,yoosanghoon,"wild how SEN made all the “wrong” moves in removing Sykko, Dephh, and Pancada, but ended up with their strongest roster ever. I feel vindicated knowing I vocally supported all (minus Sykko to an extent BUT even then I firmly believe that he chose to side with Dephh when the org wanted to remove him and got cut as a result)",1,t1_kgqbmt9,t3_190j7yd,/r/ValorantCompetitive/comments/190j7yd/some_more_answers_from_minis_ama/kgsigv2/,0,False
kgsibaq,1704663913.0,ValorantCompetitive,yoavtrachtman,"I really don’t think it’s the fault of the format. Single elimination has been in esports for decades without any complain.

They got lucky by performing well and liquid and gambit performing poorly.",1,t1_kgrzgoe,t3_190zckz,/r/ValorantCompetitive/comments/190zckz/every_valorant_champions_winner_ranked_by_acs_and/kgsibaq/,0,True
kgshwki,1704663777.0,ValorantCompetitive,WolfgangTheRevenge,Hurt about what😭? They fraudulent af all of them washed exept cNed,1,t1_kgsf7zo,t3_190zckz,/r/ValorantCompetitive/comments/190zckz/every_valorant_champions_winner_ranked_by_acs_and/kgshwki/,0,False
kgshkl0,1704663666.0,ValorantCompetitive,DannyLansdon,I was thinking the same thing after briefly browsing his vlr a couple months ago. he's been popping,1,t1_kgru7ra,t3_190zckz,/r/ValorantCompetitive/comments/190zckz/every_valorant_champions_winner_ranked_by_acs_and/kgshkl0/,0,False
kgsgxyi,1704663457.0,ValorantCompetitive,newzpaperleaf_2,"this would be interesting for sure, i think TEC has really good potential i think Abo is one of the top players in the region when hes in form so Rb with this roster could really elevate them... from the little ive seen of Bear it looks like he will fit in with BLG well if he plays controller, hes a reliable anchor",1,t1_kgreqyj,t3_18xhsvf,/r/ValorantCompetitive/comments/18xhsvf/vct_china_roster_updates/kgsgxyi/,0,False
kgsf7zo,1704662875.0,ValorantCompetitive,00izka00,it's good to know that acend hurts your ass to this day :),1,t1_kgs6k8p,t3_190zckz,/r/ValorantCompetitive/comments/190zckz/every_valorant_champions_winner_ranked_by_acs_and/kgsf7zo/,0,False
kgsf2jt,1704662823.0,ValorantCompetitive,TheyDidLizFilthy,"i’m sorry but yall not winning shyt without aspas 🌪️. 

[if you watch this video](https://youtu.be/FrLtJSpaSLI?si=pWZ0Z5xhj1acFizl), there’s statistical data that shows that LOUD lose 80% of their rounds when aspas is first blooded. that is INSANE and not a good look whatsoever. stat for stat, aspas was the #1 player in the world last year. let’s be realistic here. 

NRG, SEN, G2, etc all look fucking insane. if LOUD somehow qualify for masters madrid, i will personally apologize and donate $20 to the charity of your choice. prove me wrong but i doubt it. it’s looking like LOUD is donzo.",1,t1_kgrq9ax,t3_190ypuq,/r/ValorantCompetitive/comments/190ypuq/saadhak_reacts_to_the_lev_situation_and_loud/kgsf2jt/,0,False
kgsewxj,1704662770.0,ValorantCompetitive,PhysicalAd8765,"I think it's proven talent vs unproven. 

I don't doubt Saadhak as an igl and I doubt that others do, however it's unrealistic and unreasonable to have the same expectations for a team that *loses* proven talent. Only reason people had higher expectations for NRG than LOUD last year was because while s0m was unproven, ardiis wasn't to them compared to cauanzin and tuyz.... 

You lose proven talent = people lower expectations 

You gain proven talent = people heighten expectations 

While I personally think they'll be fine, people do have a reason to doubt as do Saadhak have reasons to feel disheartened that he's constantly underrated- eventhough it's the team due to annual change(s) and midseason fall-offs and not necessarily him.",1,t1_kgrw953,t3_190ypuq,/r/ValorantCompetitive/comments/190ypuq/saadhak_reacts_to_the_lev_situation_and_loud/kgsewxj/,0,False
kgsessy,1704662730.0,ValorantCompetitive,No_Good3710,Saadhak played CS? I thought he was ex-paladins,1,t1_kgrk7wb,t3_190ypuq,/r/ValorantCompetitive/comments/190ypuq/saadhak_reacts_to_the_lev_situation_and_loud/kgsessy/,0,False
kgsei98,1704662631.0,ValorantCompetitive,mysteryoeuf,pancada benched btw,1,t3_190zckz,t3_190zckz,/r/ValorantCompetitive/comments/190zckz/every_valorant_champions_winner_ranked_by_acs_and/kgsei98/,0,False
kgse5s8,1704662513.0,ValorantCompetitive,Gadgetbot,Nah,1,t1_kgq5swc,t3_190ol0n,/r/ValorantCompetitive/comments/190ol0n/what_vct_player_copied_5_times_would_make_the/kgse5s8/,0,False
kgsdwz1,1704662431.0,ValorantCompetitive,MacarioPro,"not really, they just went on a heater and Cned was something else. all the other players aside from kiles played above their ceiling too.",1,t1_kgs9zb2,t3_190zckz,/r/ValorantCompetitive/comments/190zckz/every_valorant_champions_winner_ranked_by_acs_and/kgsdwz1/,0,False
kgsdnpz,1704662345.0,ValorantCompetitive,TheyDidLizFilthy,this is what i’ve been wondering for WEEKS. who the fuck is gonna IGL???,1,t1_k99eqbu,t3_17v98xo,/r/ValorantCompetitive/comments/17v98xo/platchats_way_too_early_tier_list_for_vct_2024/kgsdnpz/,0,False
kgsdm0t,1704662329.0,ValorantCompetitive,JTay99,thanks bo,1,t3_190snen,t3_190snen,/r/ValorantCompetitive/comments/190snen/metizport_add_v0ng_hearthbeat_and_dreamas_to/kgsdm0t/,0,False
kgsc0c8,1704661791.0,ValorantCompetitive,LunarAvast,"RB, f0rsaken, Victor, zekken, zellsis",1,t3_190ol0n,t3_190ol0n,/r/ValorantCompetitive/comments/190ol0n/what_vct_player_copied_5_times_would_make_the/kgsc0c8/,0,False
kgsbijo,1704661631.0,ValorantCompetitive,Lqtor,Kiles might be the first and last valorant player to be carried to a championship trophy,1,t3_190zckz,t3_190zckz,/r/ValorantCompetitive/comments/190zckz/every_valorant_champions_winner_ranked_by_acs_and/kgsbijo/,0,False
kgs9zb2,1704661149.0,ValorantCompetitive,takmilo,"Because all the other teams were even worse, no?",1,t1_kgry1n5,t3_190zckz,/r/ValorantCompetitive/comments/190zckz/every_valorant_champions_winner_ranked_by_acs_and/kgs9zb2/,0,False
kgs8ay4,1704660617.0,ValorantCompetitive,MacarioPro,Already smacked a couple of friends with that one,1,t1_kgs5iyr,t3_190ypuq,/r/ValorantCompetitive/comments/190ypuq/saadhak_reacts_to_the_lev_situation_and_loud/kgs8ay4/,0,True
kgs7qt9,1704660431.0,ValorantCompetitive,zer0-_,"The big problem with Deadlock and Sage compared to Cypher and Killjoy is that you cannot reliably premeditate your utility.  
Cypher and Killjoy are setup characters which allows them to react to situations very easily. Deadlock and Sage are reactive characters that have to expose themselves/get in awkward positions to use their main utility.  
Another example of this is the difference between left- and rightclicking Yorus TP. In a scenario where you take an aggressive fight you will right click your TP in a safe spot so you can take the fight and get out. You will never take the fight, take your TP out and then left click it.

Deadlock and Sage would be a lot better if they could place down their utility and then activate it from a more remote position",1,t3_18zc687,t3_18zc687,/r/ValorantCompetitive/comments/18zc687/deadlock_sucks_but_so_does_the_discourse_around/kgs7qt9/,0,False
kgs7oy2,1704660413.0,ValorantCompetitive,lidekwhatname,goathak,1,t3_190ypuq,t3_190ypuq,/r/ValorantCompetitive/comments/190ypuq/saadhak_reacts_to_the_lev_situation_and_loud/kgs7oy2/,0,False
kgs75kk,1704660235.0,ValorantCompetitive,WolfgangTheRevenge,"Yay wouldve won champs have Victor, Fenis and Crashies not griefed him and Marved in finals😔

https://preview.redd.it/ze65c7n5y2bc1.jpeg?width=1170&amp;format=pjpg&amp;auto=webp&amp;s=bc1901937e4f66461bb30668427463c8064eb478

LOUD still goated tho",19,t3_190zckz,t3_190zckz,/r/ValorantCompetitive/comments/190zckz/every_valorant_champions_winner_ranked_by_acs_and/kgs75kk/,0,False
kgs6u1u,1704660129.0,ValorantCompetitive,MacarioPro,"I agree, but considering it's both the written (without tone and mannerisms), cultural differences and that translations aren't always perfect, I try to be as careful as I can to avoid bringing issues to these players.

I would be very sad if in the act of sharing I end up harming them.",1,t1_kgrw953,t3_190ypuq,/r/ValorantCompetitive/comments/190ypuq/saadhak_reacts_to_the_lev_situation_and_loud/kgs6u1u/,0,True
kgs6qe7,1704660096.0,ValorantCompetitive,WolfgangTheRevenge,Flukers that won cause single Elimimation,1,t1_kgry1n5,t3_190zckz,/r/ValorantCompetitive/comments/190zckz/every_valorant_champions_winner_ranked_by_acs_and/kgs6qe7/,0,False
kgs6obw,1704660078.0,ValorantCompetitive,[deleted],[deleted],1,t3_190ypuq,t3_190ypuq,/r/ValorantCompetitive/comments/190ypuq/saadhak_reacts_to_the_lev_situation_and_loud/kgs6obw/,0,False
kgs6k8p,1704660041.0,ValorantCompetitive,WolfgangTheRevenge,Only player thats wasnt ass was cNed,1,t1_kgrtonc,t3_190zckz,/r/ValorantCompetitive/comments/190zckz/every_valorant_champions_winner_ranked_by_acs_and/kgs6k8p/,0,False
kgs666l,1704659915.0,ValorantCompetitive,zer0-_,To add on to what the other person replied; the reason autimatic decided to go back to CS was DaZeD being cut from T1. DaZeD was the reason autimatic came to Valorant,1,t1_kgres1m,t3_190moai,/r/ValorantCompetitive/comments/190moai/autimatic_revealed_why_he_left_t1_valorant/kgs666l/,0,False
kgs5iyr,1704659711.0,ValorantCompetitive,turtsy__,I am stealing that two more magazines comment.,1,t1_kgrk8np,t3_190ypuq,/r/ValorantCompetitive/comments/190ypuq/saadhak_reacts_to_the_lev_situation_and_loud/kgs5iyr/,0,False
kgs56bu,1704659601.0,ValorantCompetitive,zer0-_,"This is like the single biggest misconception that people have about playing videogames professionally.  
Everyone thinks you get to do what you love for a living but in reality there's so much stress that comes with it which a lot of people never think about.

Playing and practicing in an extremely structured way like this is definitely not how the majority of people think being an esports pro is like",1,t1_kgphktb,t3_190j7yd,/r/ValorantCompetitive/comments/190j7yd/some_more_answers_from_minis_ama/kgs56bu/,0,False
kgs1bod,1704658345.0,ValorantCompetitive,blits202,Yeah basically when/if he returns to CS any NA team will be lucky to have him. Likely will take his pick at any team besides Complexity. My guess would be M80 as they are building a solid young team.,1,t1_kgpduzf,t3_190moai,/r/ValorantCompetitive/comments/190moai/autimatic_revealed_why_he_left_t1_valorant/kgs1bod/,0,False
kgs05x6,1704657969.0,ValorantCompetitive,Still_HD,Yeah sorry my bad i blanked lol,1,t1_kgruy8t,t3_190zavm,/r/ValorantCompetitive/comments/190zavm/new_case_esports_valorant_roster/kgs05x6/,0,False
kgs042x,1704657952.0,ValorantCompetitive,KaNesDeath,Dazed was good at finding macro strategies but unable to find micro adjustments. Scrimmage wise Dazed approached each one with the mentality of working on macro strategies. Which led to some players losing self confidence.,1,t1_kgres1m,t3_190moai,/r/ValorantCompetitive/comments/190moai/autimatic_revealed_why_he_left_t1_valorant/kgs042x/,0,False
