id,created_utc,subreddit,author,body,score,parent_id,link_id,permalink,controversiality,is_submitter
ku7pae5,1710075380.0,ValorantCompetitive,simurgh101,"Bruh, FULLSENSE is just too perfect rn, you mfs better not choke like MiTH last year.",1,t3_1bb9ejn,t3_1bb9ejn,/r/ValorantCompetitive/comments/1bb9ejn/full_sense_vs_made_in_thailand_afreecatv/ku7pae5/,0,False
ku7o1xp,1710074713.0,ValorantCompetitive,Prestation28,banger video go to win the master,1,t3_1bb84yw,t3_1bb84yw,/r/ValorantCompetitive/comments/1bb84yw/karmine_corp_vlog_the_secrets_of_our_first/ku7o1xp/,0,False
ku7nw64,1710074624.0,ValorantCompetitive,STARRCADE_97,Maybe the org choice mattered? MxM is a very popular org on the rise while TSM has a pretty bad relationship with Riot due to a bunch of controversies.,1,t1_ku6oz2u,t3_1bb306a,/r/ValorantCompetitive/comments/1bb306a/according_to_former_mxm_coach_taniz_tsm_was/ku7nw64/,0,False
ku7ner4,1710074352.0,ValorantCompetitive,Orrion-,"bahahahahaha par pitié arrêtez, ils nous ont déjà dans leur cœur",1,t1_ku7khzj,t3_1bb84yw,/r/ValorantCompetitive/comments/1bb84yw/karmine_corp_vlog_the_secrets_of_our_first/ku7ner4/,0,False
ku7krbn,1710072793.0,ValorantCompetitive,k4min,Amazing content😭  I'll be supporting them for the rest of the year for sure,1,t3_1bb84yw,t3_1bb84yw,/r/ValorantCompetitive/comments/1bb84yw/karmine_corp_vlog_the_secrets_of_our_first/ku7krbn/,0,False
ku7kjql,1710072661.0,ValorantCompetitive,eco999,That was sick,1,t3_1bb212q,t3_1bb212q,/r/ValorantCompetitive/comments/1bb212q/valorant_jpn_misaya_shows_off_his_verstappen_bird/ku7kjql/,0,False
ku7khzj,1710072632.0,ValorantCompetitive,Holiste,After seeing the atmosphere and determination of this team I can't do nothing but support them. +1fan,1,t3_1bb84yw,t3_1bb84yw,/r/ValorantCompetitive/comments/1bb84yw/karmine_corp_vlog_the_secrets_of_our_first/ku7khzj/,0,False
ku7jn52,1710072097.0,ValorantCompetitive,kedeith,This definitively made my day,1,t3_1bb84yw,t3_1bb84yw,/r/ValorantCompetitive/comments/1bb84yw/karmine_corp_vlog_the_secrets_of_our_first/ku7jn52/,0,False
ku7jk71,1710072044.0,ValorantCompetitive,GallyIsbestgirl,Amazing content,1,t3_1bb84yw,t3_1bb84yw,/r/ValorantCompetitive/comments/1bb84yw/karmine_corp_vlog_the_secrets_of_our_first/ku7jk71/,0,False
ku7j8r6,1710071841.0,ValorantCompetitive,neikawaaratake,"I know it sounds weird, but yes. 

Sliggy made the tierlist for split 2. And when making the tierlist, he said teams who does not qualify for shanghai might have better chance of going to champs.",1,t1_ku7f9im,t3_1bb36sz,/r/ValorantCompetitive/comments/1bb36sz/focusing_on_yourself_vs_focusing_on_your_opponent/ku7j8r6/,0,False
kvcvhio,1710719977.0,ValorantCompetitive,_ImAlive_,How is this getting upvoted? Russ was brought to igl cuz Benkai didn't want to.,1,t1_kvanwbo,t3_1bgt4nj,/r/ValorantCompetitive/comments/1bgt4nj/ge_fumbled_the_bag_by_letting_texture_go/kvcvhio/,0,False
kvcveov,1710719944.0,ValorantCompetitive,Cadesan,I mean he gave us multiple reasons to hate on him just from today,1,t1_kvcucdo,t3_1bhc0n2,/r/ValorantCompetitive/comments/1bhc0n2/th_hc_neilzinho_after_the_loss_to_prx_we_dont/kvcveov/,0,False
kvcv9g6,1710719884.0,ValorantCompetitive,PhysicalAd8765,“it doesn’t seem … **to me** … But **even then**”,1,t1_kvcf5nd,t3_1bh7hti,/r/ValorantCompetitive/comments/1bh7hti/team_heretics_coach_screaming_at_mindfreak_after/kvcv9g6/,0,False
kvcv4i6,1710719828.0,ValorantCompetitive,kstabs,"From your post history you supposedly follow the NFL and the NBA. Yet you think this is a bad post game outburst lmao?

Such a casual take. Seems like you're a casual follower of competitive sports/esports lol",1,t1_kvctonu,t3_1bhc0n2,/r/ValorantCompetitive/comments/1bhc0n2/th_hc_neilzinho_after_the_loss_to_prx_we_dont/kvcv4i6/,0,False
kvcv4d2,1710719827.0,ValorantCompetitive,xdysania,SEN selling that mid looking bundle might be the greatest marketing in gaming history,1,t3_1bhbjo4,t3_1bhbjo4,/r/ValorantCompetitive/comments/1bhbjo4/the_winner_of_madrid_will_supposedly_have_their/kvcv4d2/,0,False
kvcv0at,1710719782.0,ValorantCompetitive,ValorantCompetitive-ModTeam,Reposts (such as of breaking news) will be removed according to Rule 5.,1,t3_1bhcl7g,t3_1bhcl7g,/r/ValorantCompetitive/comments/1bhcl7g/th_vs_prx_in_nutshell/kvcv0at/,0,False
kvcv08g,1710719781.0,ValorantCompetitive,I_Neecha,Common valorant mod L,1,t1_ksy2704,t3_1b3vtr6,/r/ValorantCompetitive/comments/1b3vtr6/tweets_from_valorant_pros_indicate_n4rrate_abuses/kvcv08g/,0,False
kvcuy9x,1710719759.0,ValorantCompetitive,ValorantCompetitive-ModTeam,Reposts (such as of breaking news) will be removed according to Rule 5.,1,t3_1bhcgif,t3_1bhcgif,/r/ValorantCompetitive/comments/1bhcgif/lmao/kvcuy9x/,0,False
kvcuvaw,1710719726.0,ValorantCompetitive,_ImAlive_,"Bro just wanted better question, how is that unprofessional?",1,t1_kvcscte,t3_1bhc0n2,/r/ValorantCompetitive/comments/1bhc0n2/th_hc_neilzinho_after_the_loss_to_prx_we_dont/kvcuvaw/,0,False
kvcuuye,1710719722.0,ValorantCompetitive,ForeignUniStudent,"IVE SAID IT BEFORE AND I’LL SAY IT AGAIN, MINIBOO IS A NEON MERCHANT, ALSO SIT DOWN BENJYMIDDY",1,t3_1bh6wui,t3_1bh6wui,/r/ValorantCompetitive/comments/1bh6wui/team_heretics_vs_paper_rex_champions_tour_2024/kvcuuye/,0,False
kvcuuub,1710719721.0,ValorantCompetitive,BharathTejaM,It's Americas Vs China and EMEA vs Pacific 🤞🏼🤞🏼,1,t1_kvcuen4,t3_1bhchoy,/r/ValorantCompetitive/comments/1bhchoy/vct_2024_masters_madrid_regional_performance_end/kvcuuub/,0,True
kvcusd2,1710719693.0,ValorantCompetitive,nterature,"Not all that unusual to be a little salty or heated during a post-match press conference, not enough time passes between a loss and the conference for it those feelings to always go away. Though I think this is the first time I can recall someone has gone out of their way to clip it in a long time. 

Best to not obsess and start putting things in people’s mouths, just makes everything feel weird and makes it seem like we can’t have rivalries full of genuine tension and emotion.",1,t3_1bhc0n2,t3_1bhc0n2,/r/ValorantCompetitive/comments/1bhc0n2/th_hc_neilzinho_after_the_loss_to_prx_we_dont/kvcusd2/,0,False
kvcurdp,1710719682.0,ValorantCompetitive,very_smol,this is a Zellsis buff,1,t3_1bhbjo4,t3_1bhbjo4,/r/ValorantCompetitive/comments/1bhbjo4/the_winner_of_madrid_will_supposedly_have_their/kvcurdp/,0,False
kvcuq0v,1710719667.0,ValorantCompetitive,two4you8,"The reporter, Pedro Romero, has been putting out great content throughout this masters madrid. He basically asked, what makes PRX Split so hard for a duelist like him to thrive, relative to his already stat line throughout this tournament. 

The coach probably just heard ""KDA"" and went protective for a simple question.",1,t3_1bhc0n2,t3_1bhc0n2,/r/ValorantCompetitive/comments/1bhc0n2/th_hc_neilzinho_after_the_loss_to_prx_we_dont/kvcuq0v/,0,False
kvcuo3x,1710719646.0,ValorantCompetitive,_ImAlive_,Everyone trying to make neilzinho a villain lol. He already apologized. How did neilzinho throw a mini tantrum lol. He was just trying to make his players feel better. The agenda against him is insane when the players of prx didn't even take it seriously.,1,t3_1bhc0n2,t3_1bhc0n2,/r/ValorantCompetitive/comments/1bhc0n2/th_hc_neilzinho_after_the_loss_to_prx_we_dont/kvcuo3x/,0,False
kvcumis,1710719627.0,ValorantCompetitive,GarlicToest,"yeah I thought that was fine, he was just defending one of his players, it was a bad question anyway",1,t1_kvcrjxf,t3_1bhc0n2,/r/ValorantCompetitive/comments/1bhc0n2/th_hc_neilzinho_after_the_loss_to_prx_we_dont/kvcumis/,0,False
kvcukqw,1710719607.0,ValorantCompetitive,OcelotOce,2nd time seeing it. I remember KRU doing it to LOUD or some BR team,1,t3_1bhcgif,t3_1bhcgif,/r/ValorantCompetitive/comments/1bhcgif/lmao/kvcukqw/,0,False
kvcuf4w,1710719546.0,ValorantCompetitive,Parenegade,"&gt; substantially the better player

lol that has to be worst take i have ever seen on this subreddit congrats",1,t1_kvc8hl9,t3_1bh7r4o,/r/ValorantCompetitive/comments/1bh7r4o/has_forsaken_been_cemented_as_the_best_flex_player/kvcuf4w/,0,False
kvcuen4,1710719541.0,ValorantCompetitive,OcelotOce,We will know tmr lmao,1,t3_1bhchoy,t3_1bhchoy,/r/ValorantCompetitive/comments/1bhchoy/vct_2024_masters_madrid_regional_performance_end/kvcuen4/,0,False
kvcudzk,1710719534.0,ValorantCompetitive,efuipa,"If you initiate shit-talk only after you won, that's bitchmade. If someone shit talks you, and then you shut them up in the server, you deserve to respond. Makes sense to me.",1,t1_kvc50ud,t3_1bh7c4p,/r/ValorantCompetitive/comments/1bh7c4p/sentinels_cook_eliminated_player_post_match/kvcudzk/,0,False
kvcucdo,1710719515.0,ValorantCompetitive,ANewHeaven1,"""Mini tantrum"" is absolutely crazy lol. He stood up for his player after a loaded question and did so in a calm and professional manner. Y'all are just finding any excuse to hate on neilzinho",1,t3_1bhc0n2,t3_1bhc0n2,/r/ValorantCompetitive/comments/1bhc0n2/th_hc_neilzinho_after_the_loss_to_prx_we_dont/kvcucdo/,0,False
kvcu6zk,1710719456.0,ValorantCompetitive,NotAppreciated_Mercy,My boy got that swagger in his walk,1,t3_1bh7hti,t3_1bh7hti,/r/ValorantCompetitive/comments/1bh7hti/team_heretics_coach_screaming_at_mindfreak_after/kvcu6zk/,0,False
kvcu6j2,1710719451.0,ValorantCompetitive,masonhil,"I think you missed the point.

Unless SEN pick him up, he's not gonna be doing any more work at madrid",1,t1_kvcnsh5,t3_1bh7hti,/r/ValorantCompetitive/comments/1bh7hti/team_heretics_coach_screaming_at_mindfreak_after/kvcu6j2/,0,False
kvcu4ub,1710719433.0,ValorantCompetitive,OcelotOce,"PRX are the kind of team people either LOVE or HATE, there’s no in-between lmao",1,t3_1bhc0n2,t3_1bhc0n2,/r/ValorantCompetitive/comments/1bhc0n2/th_hc_neilzinho_after_the_loss_to_prx_we_dont/kvcu4ub/,0,False
kvcu47l,1710719425.0,ValorantCompetitive,Green_Ordinary778,what clip are you watching where he goes ’apeshit’? i was watching the interview on twitch and when this happened even the chat went ”w coach” and ”what was that question”. u can dislike the guy but let’s not lie,1,t1_kvctonu,t3_1bhc0n2,/r/ValorantCompetitive/comments/1bhc0n2/th_hc_neilzinho_after_the_loss_to_prx_we_dont/kvcu47l/,0,False
kvcu1c4,1710719392.0,ValorantCompetitive,BacePilot,"Spit yo shit benjy, the trash talking added some spice to the match",1,t3_1bh93r5,t3_1bh93r5,/r/ValorantCompetitive/comments/1bh93r5/benjyfishy_postmatch_tweet/kvcu1c4/,0,False
kvctzn9,1710719374.0,ValorantCompetitive,efuipa,The coach WAS screaming at mindfreak (source: [conf by the coach himself](https://www.reddit.com/r/ValorantCompetitive/comments/1bh7hti/comment/kvc5iot/?utm_source=share&amp;utm_medium=web2x&amp;context=3)),1,t1_kvce9k0,t3_1bh93r5,/r/ValorantCompetitive/comments/1bh93r5/benjyfishy_postmatch_tweet/kvctzn9/,0,False
kvcty6f,1710719358.0,ValorantCompetitive,TheTurkishWarlord,"The ranked account has hundreds of thousands of VP loaded though, I saw that on Forsaken’s stream.",1,t1_kvcarce,t3_1bh3wnj,/r/ValorantCompetitive/comments/1bh3wnj/does_anyone_know_who_this_is/kvcty6f/,0,False
kvcts6b,1710719291.0,ValorantCompetitive,TimedOutClock,"It's crazy to think that SEN might have already cashed in a million with that bundle (25$ Bundle, but they get 50% of the profits, so let's say they get 10$ per bundle. Nearly all their games have 500K+ viewers, so let's assume that 1/5 bought it, that's 1M right there!)

Winning Madrid and having that promo plastered in the store for all casuals to see might even push their gains by another million, and now you're starting to see how in-game skins can truly fund the scene going forward (We're not even halfway through the year, too, which is insane).

Also can't wait to see the skin ranking and see which org is gonna get slandered by being last (It HAS to be EG... If anyone is below them... RIP)",1,t3_1bhbjo4,t3_1bhbjo4,/r/ValorantCompetitive/comments/1bhbjo4/the_winner_of_madrid_will_supposedly_have_their/kvcts6b/,0,False
kvctrre,1710719286.0,ValorantCompetitive,sebaba001,They all wrote to him responding his tweet saying it's ok and they love his aim/play.,1,t1_kvcar05,t3_1bh97fc,/r/ValorantCompetitive/comments/1bh97fc/prx_something_postmatch_tweet/kvctrre/,0,False
kvctpb3,1710719259.0,ValorantCompetitive,_goodman,"""Outburst""?? My guy, you must be watching that interview through extremely tinted glasses lol.",1,t1_kvcscte,t3_1bhc0n2,/r/ValorantCompetitive/comments/1bhc0n2/th_hc_neilzinho_after_the_loss_to_prx_we_dont/kvctpb3/,0,False
kvctp0m,1710719256.0,ValorantCompetitive,JustKaleidoscope1279,"Wow what a cringe cope to say after a loss, lost respect for TH after today ngl",1,t3_1bhc0n2,t3_1bhc0n2,/r/ValorantCompetitive/comments/1bhc0n2/th_hc_neilzinho_after_the_loss_to_prx_we_dont/kvctp0m/,0,False
kvctonu,1710719252.0,ValorantCompetitive,EasiBreezi,that’s not the tantrum. the tantrum is going ape shit and insulting the reporter and making everyone in the room go ‘has this guy been in a professional setting before?”,1,t1_kvcteci,t3_1bhc0n2,/r/ValorantCompetitive/comments/1bhc0n2/th_hc_neilzinho_after_the_loss_to_prx_we_dont/kvctonu/,0,True
kvcton5,1710719252.0,ValorantCompetitive,Revanthmk23200,Its all fun and games when it's in the server.,1,t1_kvbusc9,t3_1bh6wui,/r/ValorantCompetitive/comments/1bh6wui/team_heretics_vs_paper_rex_champions_tour_2024/kvcton5/,0,False
kvctlth,1710719221.0,ValorantCompetitive,Toonie2k,"They are probably the two best for sure but players like victor, and zellsis have found decent success playing flex as well",1,t1_kvc2z8w,t3_1bh7r4o,/r/ValorantCompetitive/comments/1bh7r4o/has_forsaken_been_cemented_as_the_best_flex_player/kvctlth/,0,False
kvctiwm,1710719189.0,ValorantCompetitive,NNNEEEIIINNN,"Wasn't the investigation inconclusive? Don't get me wrong, I by no means want to defend his actions and I am not very knowledgeable on the case as, like I said, I wasn't around the Valo community then.
I see how drama was by no means the right word, mistake on my part, I am not a native speaker, apologies!",1,t1_kvar7g9,t3_1bgumev,/r/ValorantCompetitive/comments/1bgumev/who_are_some_fa_in_na_that_shouldnt_be_free_agents/kvctiwm/,0,False
kvctiqh,1710719187.0,ValorantCompetitive,johnnysmashiii,"Everyone’s raving about forsaken on raze but we need to talk about something. The guy absolutely fried on every map of the series, even keeping the Lotus map competitive. The narrative was that he’s a choker and he gets nervous… he was unplayable today. Forsaken on that split defense absolutely willed PRX to victory",1,t3_1bh6wui,t3_1bh6wui,/r/ValorantCompetitive/comments/1bh6wui/team_heretics_vs_paper_rex_champions_tour_2024/kvctiqh/,0,False
kvcthgo,1710719173.0,ValorantCompetitive,two5five1,"Half the fun of sports are the stakes and storylines, and player banter does nothing but enhance that. Nobody is attacking people’s personal character so what’s the issue?",1,t1_kvc6tab,t3_1bh7c4p,/r/ValorantCompetitive/comments/1bh7c4p/sentinels_cook_eliminated_player_post_match/kvcthgo/,0,False
kvctey2,1710719144.0,ValorantCompetitive,boobataro,"He acknowledged it in a reply of his latest tweet, but he pretty much just yelled across the stage mid match to taunt PRX/Monyet",1,t1_kvcrbyl,t3_1bh97fc,/r/ValorantCompetitive/comments/1bh97fc/prx_something_postmatch_tweet/kvctey2/,0,False
kvctet3,1710719143.0,ValorantCompetitive,nabibluu,"i would pay millions to see old eg and heretics w/ wo0t (kid also has personality) go at it in a match, but sadly... ![img](emote|t5_2g5ach|16018)",1,t1_kvcszbl,t3_1bh93r5,/r/ValorantCompetitive/comments/1bh93r5/benjyfishy_postmatch_tweet/kvctet3/,0,True
kvcteci,1710719138.0,ValorantCompetitive,Green_Ordinary778,"the question was immature and unprofessional, he was right to not have miniboo answer it",1,t1_kvcscte,t3_1bhc0n2,/r/ValorantCompetitive/comments/1bhc0n2/th_hc_neilzinho_after_the_loss_to_prx_we_dont/kvcteci/,0,False
kvctdj4,1710719128.0,ValorantCompetitive,IGLJURM23,Yall gotta remember he comes from EU Fortnite I guarantee anything he said today wasn’t nearly as bad as the stuff said during any of the FNCS finals he has competed in,1,t3_1bh93r5,t3_1bh93r5,/r/ValorantCompetitive/comments/1bh93r5/benjyfishy_postmatch_tweet/kvctdj4/,0,False
kvctcl5,1710719118.0,ValorantCompetitive,Revanthmk23200,Different game we don't care,1,t1_kvc0wf7,t3_1bh6wui,/r/ValorantCompetitive/comments/1bh6wui/team_heretics_vs_paper_rex_champions_tour_2024/kvctcl5/,0,False
kvct6cm,1710719048.0,ValorantCompetitive,Accomplished-Luck602,lol Sideshow should stay quiet at this point,1,t3_1bh7r4o,t3_1bh7r4o,/r/ValorantCompetitive/comments/1bh7r4o/has_forsaken_been_cemented_as_the_best_flex_player/kvct6cm/,0,False
kvct5y6,1710719043.0,ValorantCompetitive,Outrageous-Elk-5392,"Last years champs, demon1 on the table after beating PRX in the finals",1,t1_kvcn7w3,t3_1bh7xpp,/r/ValorantCompetitive/comments/1bh7xpp/prx_were_not_impressed/kvct5y6/,0,True
kvcszbl,1710718970.0,ValorantCompetitive,kylixer,I miss the old eg team already. The shit talk by boostio and demon1 was on a different level.,1,t3_1bh93r5,t3_1bh93r5,/r/ValorantCompetitive/comments/1bh93r5/benjyfishy_postmatch_tweet/kvcszbl/,0,False
kvcstz1,1710718910.0,ValorantCompetitive,johnnysmashiii,Yeahhhh tbh after the last round on split Monyet was yelling back. Homie deserved to talk his shit lol,1,t1_kvc8ch9,t3_1bh6wui,/r/ValorantCompetitive/comments/1bh6wui/team_heretics_vs_paper_rex_champions_tour_2024/kvcstz1/,0,False
kvcsfpk,1710718752.0,ValorantCompetitive,krazybanana,ya im glad he did must be a great morale boost. he needs that,1,t1_kvcms3g,t3_1bh93r5,/r/ValorantCompetitive/comments/1bh93r5/benjyfishy_postmatch_tweet/kvcsfpk/,0,False
kvcsf04,1710718745.0,ValorantCompetitive,Tight-Technician-372,+1,1,t1_kvcrjxf,t3_1bhc0n2,/r/ValorantCompetitive/comments/1bhc0n2/th_hc_neilzinho_after_the_loss_to_prx_we_dont/kvcsf04/,0,False
kvcscte,1710718721.0,ValorantCompetitive,EasiBreezi,"After the very awkward silence after the outburst.

“I’m not that horrible. You guys can ask questions, just not stupid ones”. 

I don’t know about you, but that is pretty immature and unprofessional from my perspective.",1,t1_kvcrjxf,t3_1bhc0n2,/r/ValorantCompetitive/comments/1bhc0n2/th_hc_neilzinho_after_the_loss_to_prx_we_dont/kvcscte/,0,True
kvcs3oz,1710718622.0,ValorantCompetitive,Withinmyrange,"Can we please stop demonizing players for shit talking, it makes it so much easier to get invested",1,t3_1bh93r5,t3_1bh93r5,/r/ValorantCompetitive/comments/1bh93r5/benjyfishy_postmatch_tweet/kvcs3oz/,0,False
kvcs3i4,1710718620.0,ValorantCompetitive,korin_korin,Definitely did the community well on Split (as usual) - 10/10!,1,t1_kvcrobq,t3_1bh6ljp,/r/ValorantCompetitive/comments/1bh6ljp/we_are_watching_a_jarso_video_right_now/kvcs3i4/,0,False
kvcs2jr,1710718609.0,ValorantCompetitive,angrypolishman,"honestly after spending 0.6 milliseconds on vlr i get it

love the players, zekken my goat, however that site brings out the worst in me",1,t1_kva3k4t,t3_1bgsf2g,/r/ValorantCompetitive/comments/1bgsf2g/if_sentinels_win_madrid_will_sacy_be_the_first/kvcs2jr/,0,False
kvcs0yh,1710718592.0,ValorantCompetitive,ChronoFelyne,Foreskin and kiddies should not be in the same sentence 💀💀💀,1,t1_kvbs719,t3_1bh6wui,/r/ValorantCompetitive/comments/1bh6wui/team_heretics_vs_paper_rex_champions_tour_2024/kvcs0yh/,0,False
kvcs07p,1710718584.0,ValorantCompetitive,raainnnyy,"PaperRex are the fucking worst nightmare of the armchair analyst. They do not make sense as a team. They make confidence based decisions. They play the game exactly how the fucking MOBA crowd hates it. Listen, there’s a subsection of playerbase out there that thinks the game needs to be defined down to the fucking numbers. The analytics. “Pushing up my glasses. Oh this lineup from this particular angle. Oh this composition doesn’t work in theory because this particular position of util 🤓.” YOU’RE GONNA GET SHOT IN THE FACE! YOU’RE GONNA LOSE THE ROUND! IT’S A GUN GAME! IT’S AN FPS! IF YOU WANT THAT, IF YOU WANT THAT PLAY OVERWATCH! IF YOU WANT THAT, PLAY LEAGUE OF LEGENDS! PLAY A DIFFERENT FUCKING GAME! THIS IS VALORANT YOU MOTHERFUCKER! YOU GET SHOT, YOU DIE! YOU GET SHOT, YOU DIE! YOU GET SHOT, YOU LOSE THE ROUND, YOU LOSE THE GAME! IT’S AN FPS GAME!",1,t3_1bhc0n2,t3_1bhc0n2,/r/ValorantCompetitive/comments/1bhc0n2/th_hc_neilzinho_after_the_loss_to_prx_we_dont/kvcs07p/,0,False
kvcs05j,1710718583.0,ValorantCompetitive,soopahfingerzz,right but i usually hear him speak portugese in interviews and post match. He probably felt right at home in front of the spanish crowd,1,t1_kvcpg5m,t3_1bh2phs,/r/ValorantCompetitive/comments/1bh2phs/funplus_phoenix_vs_loud_champions_tour_2024/kvcs05j/,0,False
kvcs05f,1710718583.0,ValorantCompetitive,BloodMaelstrom,Best flex player still needs a good mix of flexibility and results tho. F0rsaken has a larger pool but he has yet to win a single LAN whilst Chronicle has won 3 now whilst being the flex. In the end you do need to not only have a large agent pool but also have successful accomplishments and win events on those different roles.,1,t1_kvca7yn,t3_1bh7r4o,/r/ValorantCompetitive/comments/1bh7r4o/has_forsaken_been_cemented_as_the_best_flex_player/kvcs05f/,0,False
kvcrxyt,1710718560.0,ValorantCompetitive,deAlchemisz,"Please excuse them. Most of them (SEA watcher) are watching this game with a massive lacks of sleep, but with an adrenaline high enough to rival a jet engine energy after the win. Lacks of active braincell cuz lacks of sleep + adrenaline = questionable decision",1,t1_kvcoadi,t3_1bh9rte,/r/ValorantCompetitive/comments/1bh9rte/prx_mindfreak_post_match_tweet/kvcrxyt/,0,True
kvcrsd9,1710718498.0,ValorantCompetitive,AnywayHeres1Derwall,Isn’t it already in the store?,1,t3_1bhbjo4,t3_1bhbjo4,/r/ValorantCompetitive/comments/1bhbjo4/the_winner_of_madrid_will_supposedly_have_their/kvcrsd9/,0,False
kvcrobq,1710718452.0,ValorantCompetitive,Prius707,"hope I did the community well catching (mostly) everything

had such a blast observing the last map, forsaken and benjy made it easy with all the multi kills",1,t3_1bh6ljp,t3_1bh6ljp,/r/ValorantCompetitive/comments/1bh6ljp/we_are_watching_a_jarso_video_right_now/kvcrobq/,0,False
kvcrjxf,1710718403.0,ValorantCompetitive,_goodman,"Bruh. This Neilzinho witch hunt is gettkng out of hand.

Calling that ""throwing a mini-tantrum"" is pretty silly, he very calmly interjects and explains his point after a reporting asks MiniBoo about his terrible KD lol.

And as for ""respecting their opponents"", the guy said in this very interview that PRX won because they were the better team.",1,t3_1bhc0n2,t3_1bhc0n2,/r/ValorantCompetitive/comments/1bhc0n2/th_hc_neilzinho_after_the_loss_to_prx_we_dont/kvcrjxf/,0,False
kvcrjm1,1710718399.0,ValorantCompetitive,FazeXistance,In the heat of the moment the shit talk flows. It’s not that serious. It sucks these guys have to apologize like this.,1,t3_1bh97fc,t3_1bh97fc,/r/ValorantCompetitive/comments/1bh97fc/prx_something_postmatch_tweet/kvcrjm1/,0,False
kvcrjd3,1710718397.0,ValorantCompetitive,Quick_Ad_8323,"Team Heretics literally got beat by the SEN stream team and now they say this to PRX who has always qualified to every international event😂

Shameless. Gotta see them at the Airport✈️🗑️",1,t3_1bhc0n2,t3_1bhc0n2,/r/ValorantCompetitive/comments/1bhc0n2/th_hc_neilzinho_after_the_loss_to_prx_we_dont/kvcrjd3/,0,False
kvcrdwn,1710718335.0,ValorantCompetitive,BloodMaelstrom,Not playing one agent is different from not being a good flex. F0rsaken hasn’t played Brim but you certainly won’t argue he is not an elite flex player or worse then Chronicle just because of that.,1,t1_kvc8fbh,t3_1bh7r4o,/r/ValorantCompetitive/comments/1bh7r4o/has_forsaken_been_cemented_as_the_best_flex_player/kvcrdwn/,0,False
kvcrbyl,1710718313.0,ValorantCompetitive,Escolyte,What did Benjy do?,1,t1_kvc8f4t,t3_1bh97fc,/r/ValorantCompetitive/comments/1bh97fc/prx_something_postmatch_tweet/kvcrbyl/,0,False
kvcrauz,1710718301.0,ValorantCompetitive,FazeXistance,Bro deserved to be hyped he was going nuclear at the start of the 3rd map,1,t3_1bh93r5,t3_1bh93r5,/r/ValorantCompetitive/comments/1bh93r5/benjyfishy_postmatch_tweet/kvcrauz/,0,False
kvcr26b,1710718203.0,ValorantCompetitive,singaporesainz,Up and comer,1,t1_kvcgtjl,t3_1bhag4m,/r/ValorantCompetitive/comments/1bhag4m/speaking_of_onstage_antics_the_greatest_rematch/kvcr26b/,0,False
kvcr1hd,1710718195.0,ValorantCompetitive,2ToTooTwoFish,Lmaoooooo this is petty as fuck after the loss. Especially to say that against a team who's been one of the most consistent cores of the past 3 years.,1,t3_1bhc0n2,t3_1bhc0n2,/r/ValorantCompetitive/comments/1bhc0n2/th_hc_neilzinho_after_the_loss_to_prx_we_dont/kvcr1hd/,0,False
kvcqwv6,1710718145.0,ValorantCompetitive,_goodman,"That Saadhak face lives in my mind forever, there's about half a second where he looks completely deranged.

On an in-game note, from what I remember, LOUD completely shutting down KK's Jett was a large part of their win in Champs, so I'm excited to see how EDG have evolved.",1,t3_1bhag4m,t3_1bhag4m,/r/ValorantCompetitive/comments/1bhag4m/speaking_of_onstage_antics_the_greatest_rematch/kvcqwv6/,0,False
kvcqves,1710718129.0,ValorantCompetitive,MakimaGOAT,sen and prx teaming up to eliminate EMEA... WE WILL BE THERE,1,t3_1bh74iq,t3_1bh74iq,/r/ValorantCompetitive/comments/1bh74iq/master_madrid_11_matchups/kvcqves/,0,False
